J,"Moore, TE; Verboom, GA; Forest, F",,,,"Moore, Timothy E.; Verboom, G. Anthony; Forest, Felix",,,"Phylogenetics and biogeography of the parasitic genus Thesium L. (Santalaceae), with an emphasis on the Cape of South Africa",BOTANICAL JOURNAL OF THE LINNEAN SOCIETY,,,English,Article,,,,,,hemiparasite; parasite; southern Africa; trans-Atlantic dispersal,RADIATION; INCONGRUENCE; PLANT; FLORA; CHLOROPLAST; DIVERSITY; ORIGIN; REGION,"Thesium is a large genus of parasitic shrubs belonging to tribe Thesieae of Santalaceae. It has a principally Old World distribution, with the greatest diversity being found in southern Africa. Little is known about the relationships within Thesium or its relationships with its closest relatives. In this article, we present a first estimate of species-level phylogenetic relationships in Thesium based on internal transcribed spacer (ITS) and trnL-trnF sequence data, and use this to explore the biogeographical history of the group. One hundred and four samples representing 72 Thesium spp. were included in a phylogenetic analysis. Plastid and combined data resolve Thesium as paraphyletic relative to Thesidium and Austroamericium with high posterior probability and bootstrap support. ITS sequence data place Thesidium as sister to a large Thesium clade, but with weak support. Ancestral range reconstruction and dating analysis suggest a southern African origin for the group, with a crown age of 39.1 +/- 11.9 Mya, followed by dispersal into Europe and South America. A large clade of Cape species split in the Miocene from a clade comprising tropical species (25.5 +/- 7.3 Mya) with the diversification of extant species beginning at 16.7 +/- 6.3 Mya. (C) 2010 The Linnean Society of London, Botanical Journal of the Linnean Society, 2010, 162, 435-452.","[Moore, Timothy E.; Verboom, G. Anthony] Univ Cape Town, Dept Bot, ZA-7701 Rondebosch, South Africa; [Forest, Felix] Royal Bot Gardens, Jodrell Lab, Richmond TW9 3DS, Surrey, England","University of Cape Town; Royal Botanic Gardens, Kew","Moore, TE (corresponding author), Univ Cape Town, Dept Bot, ZA-7701 Rondebosch, South Africa.",timothy.moore@uct.ac.za,"Verboom, George Anthony/ABA-1499-2022","Verboom, George Anthony/0000-0002-1363-9781","National Research Foundation of South Africa; Royal Botanic Gardens, Kew","National Research Foundation of South Africa(National Research Foundation - South Africa); Royal Botanic Gardens, Kew","The authors would like to thank T. Trinder-Smith, N. Wilding and R. P. Skelton for assistance in the field; J. Manning for help with collecting and identifying many specimens; E. Kapinos and D. Macaya for laboratory assistance, as well as laboratory members at Jodrell Laboratory, Royal Botanic Gardens Kew; SANParks; and Western Cape Nature for permission to collect material from reserves in the Western Cape. Funding for this project was provided by the National Research Foundation of South Africa and the Royal Botanic Gardens, Kew.",,73,27,28,1,6,OXFORD UNIV PRESS,OXFORD,"GREAT CLARENDON ST, OXFORD OX2 6DP, ENGLAND",0024-4074,1095-8339,,BOT J LINN SOC,Bot. J. Linnean Soc.,MAR,2010,162,3,,,,,435,452,,10.1111/j.1095-8339.2010.01032.x,http://dx.doi.org/10.1111/j.1095-8339.2010.01032.x,,,18,Plant Sciences,Science Citation Index Expanded (SCI-EXPANDED),Plant Sciences,566VW,,Bronze,,,2023-05-23,WOS:000275402300002,View Full Record in Web of Science
J,"Shahi Shavvon, R; Saeidi Mehrvarz, S; Golmohammadi, N",,,,"Shahi Shavvon, Robabeh; Saeidi Mehrvarz, Shahryar; Golmohammadi, Narges",,,Evidence from micromorphology and gross morphology of the genus Loranthus (Loranthaceae) in Iran,TURKISH JOURNAL OF BOTANY,,,English,Article,,,,,,Loranthaceae; gross morphology; anatomy; micromorphology; Iran,CLASSIFICATION; VISCIN,"The genus Loranthus L. (Loranthaceae) is represented in Iran by 2 species: Loranthus europaeus Jacq. and L. grewingkii Boiss. & Buhse; the latter species is endemic to the area of Flora Iranica. The plants of Loranthus are hemiparasites growing on various host trees such as Quercus infectoria Oliv., Acer monspessulanum L., and Armeniaca vulgaris Lam. In order to investigate the range of morphological variation in different populations of these species, an inclusive gross morphological and micromorphological study was conducted. For this purpose, the anatomical characteristics of the stem, leaf, petiole, and fruit were also investigated. The most prominent features were the presence or absence of calcium oxalate crystals, their types, and distribution. In general, 3 types of wax crystalloid structures are identified on the leaf surface, including irregular glandular as well as platelet in L. grewingkii and smooth in L. europaeus. The crystalloid structures of the wax allow differentiation of both species. Seed surface ornamentation demonstrates little difference among these taxa. The seed surface is deeply wrinkled in L. europaeus and shallowly wrinkled in L. grewingkii. Finally, 62 qualitative characters were scored and analysed by both cluster analysis and principle component analysis (PCA), resulting in 2 distinct groups.","[Shahi Shavvon, Robabeh; Saeidi Mehrvarz, Shahryar; Golmohammadi, Narges] Univ Guilan, Fac Sci, Dept Biol, Rasht, Iran",University of Guilan,"Shahi Shavvon, R (corresponding author), Univ Guilan, Fac Sci, Dept Biol, POB 41335-1914, Rasht, Iran.",saeidimz@guilan.ac.ir,"Shahi Shavvon, Robabeh/HZJ-5961-2023","Shahi Shavvon, Robabeh/0000-0002-1686-6197",,,,,32,13,15,0,13,TUBITAK SCIENTIFIC & TECHNICAL RESEARCH COUNCIL TURKEY,ANKARA,"ATATURK BULVARI NO 221, KAVAKLIDERE, ANKARA, 00000, TURKEY",1300-008X,1303-6106,,TURK J BOT,Turk. J. Bot.,,2012,36,6,,,,,655,666,,10.3906/bot-1105-22,http://dx.doi.org/10.3906/bot-1105-22,,,12,Plant Sciences,Science Citation Index Expanded (SCI-EXPANDED),Plant Sciences,056IB,,Bronze,,,2023-05-23,WOS:000312480500005,View Full Record in Web of Science
J,"Jonstrup, A; Andersson, S; Hedren, M",,,,"Jonstrup, Anneli; Andersson, Stefan; Hedren, Mikael",,,Genetic structure in parasitic Rhinanthus angustifolius is determined by geographical distance rather than habitat - implications for taxonomy and conservation,NORDIC JOURNAL OF BOTANY,,,English,Article,,,,,,conservation; local adaptation; genetic structure,POPULATION SUBDIVISION; MICROSATELLITE MARKERS; SOFTWARE; ENVIRONMENT; PROGRAM; NUMBER; DIFFERENTIATION; ADAPTATION; INFERENCE; L.,"Analyses of intraspecific genetic structure can promote the conservation of genetic diversity of rare or declining plant species by enabling identification of proper management units. Here we investigate the genetic structure of the annual hemiparasitic herb Rhinanthus angustifolius to evaluate the genetic distinctness of two currently described subspecies and three habitat-related groups of populations inferred from recent common-garden data. Data from 11 nuclear microsatellite loci, obtained from 17 southern Swedish populations of R. angustifolius, were analyzed with a variety of population genetic techniques to examine how intraspecific genetic structure relates to taxonomy, habitat and geography. Neither the two subspecies nor the three recently identified population groups formed genetically coherent lineages. Rather, there was a clear isolation-by-distance pattern, pointing to a major role of geographically restricted gene flow in structuring the diversity at the putatively neutral microsatellite loci. Although uncertainties remain regarding the influence of homoplasy and possible introgression from the closely related R. minor, our microsatellite data argue against the recognition of previously identified subspecies or population groups as management units for conservation purposes. As currently described entities do not contain much unique genetic variation, we recommend conserving populations from a large geographical range, rather than populations from specific habitats, to preserve the long-term evolutionary potential of the species.","[Jonstrup, Anneli; Andersson, Stefan; Hedren, Mikael] Lund Univ, Dept Biol, Biodivers, Lund, Sweden",Lund University,"Andersson, S (corresponding author), Lund Univ, Dept Biol, Biodivers, Lund, Sweden.",stefan.andersson@biol.lu.se,"Andersson, Stefan/E-1349-2016","Andersson, Stefan/0000-0003-3828-5016",Kungliga Fysiografiska Sallskapet i Lund; Anna och Svante Murbecks minnesfond,Kungliga Fysiografiska Sallskapet i Lund; Anna och Svante Murbecks minnesfond,The work was supported by Kungliga Fysiografiska Sallskapet i Lund and Anna och Svante Murbecks minnesfond (to AJ).,,59,1,1,5,17,WILEY,HOBOKEN,"111 RIVER ST, HOBOKEN 07030-5774, NJ USA",0107-055X,1756-1051,,NORD J BOT,Nord. J. Bot.,DEC,2018,36,12,,,,,,,e01941,10.1111/njb.01941,http://dx.doi.org/10.1111/njb.01941,,,10,Plant Sciences,Science Citation Index Expanded (SCI-EXPANDED),Plant Sciences,HF4KX,,,,,2023-05-23,WOS:000454203200006,View Full Record in Web of Science
J,"Scotton, M; Piccinin, L; Coraiola, M",,,,"Scotton, M.; Piccinin, L.; Coraiola, M.",,,Seed production of a subalpine Festuca nigrescens-Agrostis capillaris semi-natural grassland in the eastern Italian Alps,PLANT BIOSYSTEMS,,,English,Article,,,,,,viability; germinability; Fertile stem density; standing seed yield; floret site utilization; seed production,RAIN; RHINANTHUS; DYNAMICS; PRAIRIE; PLANTS; FIELD; BANK,"Studying the seed production of semi-natural grasslands helps to understand their regeneration processes and to evaluate the possibility of collecting seed useful for ecological restoration. In a subalpine Festuca nigrescens-Agrostis capillaris meadow, the development of the main grasses' seed production and the standing seed yield at meadow maturity were studied. The inflorescence size was in the lower part of the variation range reported in previous studies. The seed viability was average to high and durable. The biological floret site utilization was mostly above 50%. With 458 fertile stems m(-2), the seeds produced (all seeds produced up to the time of the meadow maturity) by the main grasses were 21,000m(-2), of which 77% were of A. capillaris and 81% were viable. On a 3-year average, the standing seed yield (seeds present on the plants, i.e. produced minus shed seeds) at meadow maturity was 6953 seedsm(-2). Amount and composition of the produced seeds were affected mainly by the variability among years of the fertile stems density of the perennial grasses and the annual hemiparasite Rhinanthus freynii. The percentage of produced seeds which formed the standing seed yield was affected mainly by the collecting date.","[Scotton, M.; Piccinin, L.; Coraiola, M.] Univ Padua, Dept Agron Food Nat Resources Anim & Environm, Agripolis, I-35020 Legnaro, PD, Italy",University of Padua,"Scotton, M (corresponding author), Univ Padua, Dept Agron Food Nat Resources Anim & Environm, Agripolis, Viale Univ 16, I-35020 Legnaro, PD, Italy.",michele.scotton@unipd.it,,"SCOTTON, MICHELE/0000-0002-0221-0875",Natural Park Paneveggio Pale di San Martino,Natural Park Paneveggio Pale di San Martino,The research was financed by the Natural Park Paneveggio Pale di San Martino.,,38,6,6,0,19,TAYLOR & FRANCIS LTD,ABINGDON,"4 PARK SQUARE, MILTON PARK, ABINGDON OX14 4RN, OXON, ENGLAND",1126-3504,1724-5575,,PLANT BIOSYST,Plant Biosyst.,MAR 4,2015,149,2,,,,,404,414,,10.1080/11263504.2013.853702,http://dx.doi.org/10.1080/11263504.2013.853702,,,11,Plant Sciences,Science Citation Index Expanded (SCI-EXPANDED),Plant Sciences,CB7EP,,,,,2023-05-23,WOS:000349789700021,View Full Record in Web of Science
J,"Lira, J; Caires, CS; Fadini, RF",,,,"Lira, Jessica; Caires, Claudenir S.; Fadini, Rodrigo F.",,,Reaching the canopy on the ground: incidence of infection and host-use by mistletoes (Loranthaceae and Viscaceae) on trees felled for timber in Amazonian rainforests,PLANT ECOLOGY,,,English,Article,,,,,,Hemiparasite; Host-parasite interaction; Mistletoe assembly; Reduced Impact Logging,NEW-ZEALAND; ECOLOGY; SPECIFICITY; WOODLANDS; PATTERNS; RESOURCE; DENSITY,"There is a profound absence of knowledge of infestation prevalence and host-use by mistletoes of mature South American tropical rainforests. In this study, we fill this gap using information gathered from felled trees at a logging concession area in Amazonian Brazil. We sampled individuals of 18 tree species, which occurred in two forest physiognomies; open forest with canopy interrupted by palm trees and closed, denser forest, with emergent trees. We hypothesized that infection incidence would be higher in open than in closed forest, irrespective of the mistletoe species involved. In addition, we expected that mistletoe parasitism would be higher on host species that were more abundant, taller, deciduous, and had less dense wood. We sampled 870 individual trees in both sites combined. All but one host species was infected by at least one species of mistletoe. We found 13 mistletoe species/morphospecies, Loranthaceae (7) and Viscaceae (6), parasitizing very different hosts. Mistletoe infection incidence was higher in the closed forest (10.3%) than in the open forest (5.4%). In the closed forest, host height influenced incidence positively, while deciduousness had a negative influence. Our results show that mistletoes are common in the canopy of pristine tropical forests and, contrary to expectations, that infection incidence was higher in the closed forest. The positive relation between infection incidence and host height in this forest type suggests that emergent trees have higher chances of being infected than individuals of correspondent species in the lower forest layers.","[Lira, Jessica; Fadini, Rodrigo F.] Univ Fed Oeste Para, Programa Posgrad Recursos Nat Amazonia, Rua Vera Paz S-N, BR-68100000 Santarem, PA, Brazil; [Caires, Claudenir S.] Univ Estadual Sudoeste Bahia, Dept Ciencias Nat, Estr Bem Querer S-N, BR-45083900 Vitoria Da Conquista, BA, Brazil; [Fadini, Rodrigo F.] Univ Fed Oeste Para, Inst Biodiversidade & Florestas, Rua Vera Paz S-N, BR-68100000 Santarem, PA, Brazil",Universidade Federal do Oeste do Para; Universidade Estadual do Sudoeste da Bahia; Universidade Federal do Oeste do Para,"Fadini, RF (corresponding author), Univ Fed Oeste Para, Programa Posgrad Recursos Nat Amazonia, Rua Vera Paz S-N, BR-68100000 Santarem, PA, Brazil.",rfadini@gmail.com,"Fadini, Rodrigo/C-7574-2013","Fadini, Rodrigo/0000-0002-6873-1438; Caires, Claudenir/0000-0002-2012-5164",Coordenacao de Aperfeicoamento Pessoal de Nivel Superior (CAPES),Coordenacao de Aperfeicoamento Pessoal de Nivel Superior (CAPES)(Coordenacao de Aperfeicoamento de Pessoal de Nivel Superior (CAPES)),"We appreciate the help of our field assistants, Mr. Sabbat and Eucielde Pantoja de Oliveira, and the logistical support of Coomflona. We thank the Coordenacao de Aperfeicoamento Pessoal de Nivel Superior (CAPES) for the scholarship granted to the first author and the Instituto Chico Mendes de Conservacao da Biodiversidade (ICMBio) for authorizing research in a Conservation Unit (SISBIO 36066). Rafael Arruda, Ricardo Scoles, Ademir Ruschel, and two anonymous reviewers made important contributions to the early versions of the manuscript. Adrian Barnett helped with the English. This is publication 19 of Parasitic Plants Research Group.",,59,2,4,1,18,SPRINGER,DORDRECHT,"VAN GODEWIJCKSTRAAT 30, 3311 GZ DORDRECHT, NETHERLANDS",1385-0237,1573-5052,,PLANT ECOL,Plant Ecol.,MAR,2017,218,3,,,,,251,263,,10.1007/s11258-016-0683-9,http://dx.doi.org/10.1007/s11258-016-0683-9,,,13,Plant Sciences; Ecology; Forestry,Science Citation Index Expanded (SCI-EXPANDED),Plant Sciences; Environmental Sciences & Ecology; Forestry,EL9XO,,,,,2023-05-23,WOS:000394973600002,View Full Record in Web of Science
J,"Oyekale, SA; Badu-Apraku, B; Adetimirin, VO; Unachukwu, N; Gedil, M",,,,"Oyekale, Solomon A.; Badu-Apraku, Baffour; Adetimirin, Victor O.; Unachukwu, Nnanna; Gedil, Melaku",,,Development of Extra-Early Provitamin A Quality Protein Maize Inbreds with Resistance/Tolerance to Striga hermonthica and Soil Nitrogen Stress,AGRONOMY-BASEL,,,English,Article,,,,,,Striga hermonthica; low soil nitrogen; high soil nitrogen; extra-early; provitamin A quality protein maize; beta-carotene markers,IMPROVING NUTRITIONAL QUALITY; COMBINING ABILITY; GENETIC-VARIABILITY; HETEROTIC GROUPS; GRAIN-YIELD; DROUGHT; PERFORMANCE; TOLERANCE; LINES; COMPONENTS,"A hemiparasitic plant, Striga hermonthica (Del.) Benth and soil nitrogen stress are the key constraints to maize (Zea mays L.) productivity in sub-Saharan Africa, where commonly cultivated maize is the normal endosperm type that is deficient in provitamin A, tryptophan and lysine (PVATL). Seventy-six extra-early maize inbreds with provitamin A, tryptophan, and lysine qualities (TZEEIORQ) were developed to address these constraints, and four checks were assessed under Striga, low and high nitrogen conditions at three locations in Nigeria. The inbreds were further genotyped with two beta-carotene hydroxylase 1 (crtRB1) markers, and their seeds were quantified for provitamin A content. Significant (p < 0.01) genetic variations were observed for grain yield and other agronomic attributes of the inbreds under varying environmental conditions. Levels of PVATL for the inbreds ranged from 2.21-10.95 mu g g(-1), 0.04-0.08%, and 0.19-0.39%, respectively. Beta-carotene marker, crtRB1-3'TE, was polymorphic and grouped the inbreds into two. The marker was effective in identifying inbreds with moderate provitamin A content. Inbreds TZEEIORQ 5, TZEEIORQ 52, and TZEEIORQ 55 exhibited resistance to Striga, tolerance to nitrogen stress with moderate levels of PVATL and could be invaluable sources of favorable alleles for breeding nutritionally improved maize varieties with resistance/tolerance to Striga and soil nitrogen stress.","[Oyekale, Solomon A.] Univ Ibadan, Pan African Univ Inst Life & Earth Sci PAULESI, PMB 5320, Ibadan, Oyo State, Nigeria; [Oyekale, Solomon A.] Ladoke Akintola Univ Technol, Dept Crop Prod & Soil Sci, PMB 4000, Ogbomosho, Oyo State, Nigeria; [Badu-Apraku, Baffour; Unachukwu, Nnanna; Gedil, Melaku] Int Inst Trop Agr IITA, PMB 5320, Ibadan, Oyo State, Nigeria; [Adetimirin, Victor O.] Univ Ibadan, Dept Crop & Hort Sci, PMB 5320, Ibadan, Oyo State, Nigeria",University of Ibadan; CGIAR; International Institute of Tropical Agriculture (IITA); University of Ibadan,"Badu-Apraku, B (corresponding author), Int Inst Trop Agr IITA, PMB 5320, Ibadan, Oyo State, Nigeria.",saoyekale13@lautech.edu.ng; b.badu-apraku@cgiar.org; vo.adetimirin@ui.edu.ng; n.unachukwu@cgiar.org; M.Gedil@cgiar.org,"Gedil, Melaku/H-9445-2019","Gedil, Melaku/0000-0002-6258-6014; BADU-APRAKU, BAFFOUR/0000-0003-0113-5487; Adetimirin, Victor/0000-0001-8434-6110; Oyekale, Solomon/0000-0001-5284-1440","Pan African University Institute of Life and Earth Sciences (Health and Agriculture), University of Ibadan, Ibadan, Nigeria; Drought Tolerant Maize for Africa Project of the Bill and Melinda Gates Project, IITA, Ibadan, Nigeria [OPP1134248]","Pan African University Institute of Life and Earth Sciences (Health and Agriculture), University of Ibadan, Ibadan, Nigeria; Drought Tolerant Maize for Africa Project of the Bill and Melinda Gates Project, IITA, Ibadan, Nigeria","The information presented in this article is a part of the PhD research of the first author funded by the Pan African University Institute of Life and Earth Sciences (Including Health and Agriculture), University of Ibadan, Ibadan, Nigeria and the Drought Tolerant Maize for Africa Project of the Bill and Melinda Gates Project (OPP1134248), IITA, Ibadan, Nigeria. The funding bodies did not participate in the design, collection, analysis, interpretation of data, and writing the manuscript.",,56,1,1,0,1,MDPI,BASEL,"ST ALBAN-ANLAGE 66, CH-4052 BASEL, SWITZERLAND",,2073-4395,,AGRONOMY-BASEL,Agronomy-Basel,MAY,2021,11,5,,,,,,,891,10.3390/agronomy11050891,http://dx.doi.org/10.3390/agronomy11050891,,,23,Agronomy; Plant Sciences,Science Citation Index Expanded (SCI-EXPANDED),Agriculture; Plant Sciences,SG2YI,,"Green Published, gold",,,2023-05-23,WOS:000653308700001,View Full Record in Web of Science
J,"Darshetkar, AM; Pable, AA; Nadaf, AB; Barvkar, VT",,,,"Darshetkar, Ashwini M.; Pable, Anupama A.; Nadaf, Altafhusain B.; Barvkar, Vitthal T.",,,Understanding parasitism in Loranthaceae: Insights from plastome and mitogenome of Helicanthes elastica,GENE,,,English,Article,,,,,,Biorganellar genomes; Evolution; Intensified selection; Relaxed selection; Santalales,COMPLETE CHLOROPLAST GENOME; MULTIPLE SEQUENCE ALIGNMENT; TRNASCAN-SE; GENE-TRANSFER; LIFE-STYLE; MITOCHONDRIAL; EVOLUTION; PHYLOGENY; DYNAMICS; TOOLS,"Loranthaceae is the largest family of the order Santalales and includes root and stem hemiparasites. The parasites are known to exhibit reductions in the genomic features as well as relaxed or intensified selection shifts. In this study, we report plastome and mitogenome sequence of Helicanthes elastica (subtribe Amyeminae, tribe Lor-antheae), an endemic, monotypic genus of Western Ghats, India growing on remarkably diverse host range. The length of plastome sequence was 1,28,805 bp while that of mitogenome was 1,65,273 bp. This is the smallest mitogenome from Loranthaceae reported till date. The plastome of Helicanthes exhibited loss of ndh genes (psi ndhB), psi infA, rps15, rps16, rpl32, trnK-UUU, trnG-UCC, trnV-UAC and trnA-UGC while mitogenome exhibited pseudogenized cox2, nad1 and nad4 genes. The comparative study of Loranthaceae plastomes revealed that the pseudogenization or loss of genes was not specific to any genus or tribe and variation was noted in the number of introns of clpP gene in the family. Several photosynthetic genes have undergone relaxed selection supporting lower photosynthetic rates in parasitic plants while some respiratory genes exhibited intensified selection sup-porting the idea of host-parasite arm race in Loranthaceae. The plastome gene content was found conserved in root hemiparasites compared to stem hemiparasites. The atp1 gene of mitogenome was chimeric and part of it exhibited similarities with Lamiales members. The phylogenetic analysis based on plastid genes placed Heli-canthes sister to the members of subtribe Dendrophthoinae.","[Darshetkar, Ashwini M.; Nadaf, Altafhusain B.; Barvkar, Vitthal T.] Savitribai Phule Pune Univ, Dept Bot, Pune 411007, India; [Pable, Anupama A.] Savitribai Phule Pune Univ, Dept Microbiol, Pune 411007, India",Savitribai Phule Pune University; Savitribai Phule Pune University,"Nadaf, AB; Barvkar, VT (corresponding author), Savitribai Phule Pune Univ, Dept Bot, Pune 411007, India.",darshetkar.ashwini@gmail.com; anupamapable@unipune.ac.in; abnadaf@unipune.ac.in; bvitthal@unipune.ac.in,,"Darshetkar, Ashwini/0000-0002-1839-8091; Nadaf, Altafhusain/0000-0002-6898-7636",Savitribai Phule Pune University [SPPU-PDF/ST/BL/2021/0001],Savitribai Phule Pune University,"Acknowledgements First author acknowledges the Savitribai Phule Pune University for awarding post-doctoral fellowship [SPPU-PDF/ST/BL/2021/0001] . The authors thank Dr. Rani Bhagat and Mr. Bhushan Shigwan for their help during collecting the species. Authors are thankful to the Maharashtra State Biodiversity Board, Nagpur (MSBB) for providing permission to collect the samples.",,104,0,0,4,4,ELSEVIER,AMSTERDAM,"RADARWEG 29, 1043 NX AMSTERDAM, NETHERLANDS",0378-1119,1879-0038,,GENE,Gene,APR 20,2023,861,,,,,,,,147238,10.1016/j.gene.2023.147238,http://dx.doi.org/10.1016/j.gene.2023.147238,,FEB 2023,17,Genetics & Heredity,Science Citation Index Expanded (SCI-EXPANDED),Genetics & Heredity,8X2PR,36736502,,,,2023-05-23,WOS:000931860000001,View Full Record in Web of Science
