J,"Ducarme, V; Wesselingh, RA",,,,"Ducarme, Veronique; Wesselingh, Renate A.",,,Performance of two Rhinanthus species under different hydric conditions,PLANT ECOLOGY,,,English,Article,,,,,,Environmental effects; Flowering; Germination; Hydric treatments; Orobanchaceae; Seed production,HORDEUM-VULGARE; MINOR L; HOST; FLOWS; SEROTINUS; GROWTH; SCROPHULARIACEAE; ANGUSTIFOLIUS; HYBRIDIZATION; ASSOCIATION,"Rhinanthus angustifolius and Rhinanthus minor are annual hemiparasitic herbs found in open vegetations. They are closely related, hybridize frequently, and appear to have largely overlapping niches, although some floras report a preference of R. angustifolius for more humid conditions compared to R. minor. We analysed the relative fitness of both species by following their fate from germination to seed production in three different hydric treatments (wet, moist and dry) in a garden experiment. We found that R. angustifolius was either as fit as or fitter than R. minor in all conditions and for all studied parameters, with a slightly higher flower production in R. angustifolius in the wet treatment. Wet conditions had a negative effect on germination and flowering rate, but they increased flower and seed production. These observations show that environmental conditions will influence the composition of mixed Rhinanthus populations.","[Ducarme, Veronique; Wesselingh, Renate A.] Univ Catholique Louvain, Unite Ecol & Biogeog, Biodivers Res Ctr, B-1348 Louvain La Neuve, Belgium",Universite Catholique Louvain,"Wesselingh, RA (corresponding author), Univ Catholique Louvain, Unite Ecol & Biogeog, Biodivers Res Ctr, Croix Sud 4-5, B-1348 Louvain La Neuve, Belgium.",renate.wesselingh@uclouvain.be,"Wesselingh, Renate A./F-4240-2011","Wesselingh, Renate A./0000-0003-0241-2255",Fund for Scientific Research-FNRS [FRFC 2.4573.02]; Fonds Speciaux de Recherche of the Universite catholique de Louvain,Fund for Scientific Research-FNRS(Fonds de la Recherche Scientifique - FNRS); Fonds Speciaux de Recherche of the Universite catholique de Louvain,"We thank the managers of the nature reserves Doode Bemde and Housta-Darquenne for their permission to collect seeds, Linda Dhondt, Jung Fabry, Jean-Pierre Motte and Christine Noel for technical assistance and the Fund for Scientific Research-FNRS (FRFC 2.4573.02) and the Fonds Speciaux de Recherche of the Universite catholique de Louvain for financial support. Comments of two anonymous reviewers have helped us to improve upon an earlier version of the manuscript. This is publication number BRC129 of the Biodiversity Research Centre, Universite catholique de Louvain.",,40,9,10,0,14,SPRINGER,DORDRECHT,"VAN GODEWIJCKSTRAAT 30, 3311 GZ DORDRECHT, NETHERLANDS",1385-0237,1573-5052,,PLANT ECOL,Plant Ecol.,FEB,2010,206,2,,,,,263,277,,10.1007/s11258-009-9640-1,http://dx.doi.org/10.1007/s11258-009-9640-1,,,15,Plant Sciences; Ecology; Forestry,Science Citation Index Expanded (SCI-EXPANDED),Plant Sciences; Environmental Sciences & Ecology; Forestry,537AY,,,,,2023-05-23,WOS:000273086400007,View Full Record in Web of Science
J,"Koenig, WD; Knops, JMH; Carmen, WJ; Pesendorfer, MB; Dickinson, JL",,,,"Koenig, Walter D.; Knops, Johannes M. H.; Carmen, William J.; Pesendorfer, Mario B.; Dickinson, Janis L.",,,Effects of mistletoe (Phoradendron villosum) on California oaks,BIOLOGY LETTERS,,,English,Article,,,,,,mistletoe; Quercus; Phoradendron; acorn production,CENTRAL COASTAL CALIFORNIA; DWARF MISTLETOE; ARCEUTHOBIUM-PUSILLUM; ACORN PRODUCTION; SPRUCE; GROWTH; PLANTS,"Mistletoes are a widespread group of plants often considered to be hemiparasitic, having detrimental effects on growth and survival of their hosts. We studied the effects of the Pacific mistletoe, Phoradendron villosum, a member of a largely autotrophic genus, on three species of deciduous California oaks. We found no effects of mistletoe presence on radial growth or survivorship and detected a significant positive relationship between mistletoe and acorn production. This latter result is potentially explained by the tendency of P. villosum to be present on larger trees growing in nitrogen-rich soils or, alternatively, by a preference for healthy, acorn-producing trees by birds that potentially disperse mistletoe. Our results indicate that the negative consequences of Phoradendron presence on their hosts are negligible-this species resembles an epiphyte more than a parasite-and outweighed by the important ecosystem services mistletoe provides.","[Koenig, Walter D.; Pesendorfer, Mario B.; Dickinson, Janis L.] Cornell Lab Ornithol, Ithaca, NY 14850 USA; [Koenig, Walter D.] Cornell Univ, Dept Neurobiol & Behav, Ithaca, NY 14853 USA; [Knops, Johannes M. H.] Univ Nebraska, Sch Biol Sci, Lincoln, NE 68588 USA; [Carmen, William J.] Carmen Ecol Consulting, 145 Eldridge Ave, Mill Valley, CA 94941 USA",Cornell University; Cornell University; University of Nebraska System; University of Nebraska Lincoln,"Koenig, WD (corresponding author), Cornell Lab Ornithol, Ithaca, NY 14850 USA.;Koenig, WD (corresponding author), Cornell Univ, Dept Neurobiol & Behav, Ithaca, NY 14853 USA.",wdk4@cornell.edu,"Pesendorfer, Mario/ABD-7365-2021; Pesendorfer, Mario/H-6636-2019; Knops, Johannes/AAA-8546-2020","Pesendorfer, Mario/0000-0002-7994-7090; Koenig, Walter/0000-0001-6207-1427","National Science Foundation [DEB-0816691, DEB-1256394]",National Science Foundation(National Science Foundation (NSF)),"This research was supported by the National Science Foundation, grant nos DEB-0816691 and DEB-1256394 to W.D.K.",,25,5,6,2,26,ROYAL SOC,LONDON,"6-9 CARLTON HOUSE TERRACE, LONDON SW1Y 5AG, ENGLAND",1744-9561,1744-957X,,BIOL LETTERS,Biol. Lett.,JUN,2018,14,6,,,,,,,20180240,10.1098/rsbl.2018.0240,http://dx.doi.org/10.1098/rsbl.2018.0240,,,4,Biology; Ecology; Evolutionary Biology,Science Citation Index Expanded (SCI-EXPANDED),Life Sciences & Biomedicine - Other Topics; Environmental Sciences & Ecology; Evolutionary Biology,GL3CQ,29925562,"Green Published, Bronze",,,2023-05-23,WOS:000437005700019,View Full Record in Web of Science
J,"Vera, A; Maldonado, R; Socorro, Y; Martinez, M",,,,"Vera, Antonio; Maldonado, Rafael; Socorro, Yajaira; Martinez, Maritza",,,"Interaction pattern of Struthanthus dichotrianthus in the xerophytic scrubland, wildlife reserve Cienaga de La Palmita and Isla de Pajaros, Zulia state",REVISTA DE LA FACULTAD DE AGRONOMIA DE LA UNIVERSIDAD DEL ZULIA,,,Spanish,Article,,,,,,loranthaceae; mistletoe; Pithecellobium dulce; Quadrella odoratissima; Struthanthus dichotrianthus; xerophytic vegetation,LORANTHACEAE,"The interaction pattern of Struthanthus dichotrianthus was determined in the xerophytic scrubland of the wildlife reserve Cienaga de La Palmita and Isla de Pajaros, Zulia state. Five plots of 20 m x 50 m (1000 m(2) = 0.1 ha) were delimited and the samplings were carried out between January-April 2016 in drought. We quantified 368 woody plants (30 species-18 families) and 467 individuals of S. dichotrianthus. Morisonia americana, Pithecellobium dulce, Quadrella odoratissima and Ruprechtia ramiflora were the hemiparasitized species, representing 13.3% of the total, and the four only grouped 33 hemiparasitized individuals (9%). The predominance and intensity of hemiparasitism and the rate of hemiparasitized individuals of P. dulce showed that S. dichotrianthus presented a greater preference for this host. Struthanthus dichotrianthus turned out to be an effectively generalist species, despite showing a very low resource index, that is, it concentrated its interaction capacity on few woody species.","[Vera, Antonio; Maldonado, Rafael; Socorro, Yajaira] Ctr Invest Biol, Lab Ecol, Madrid, Spain; [Martinez, Maritza] Univ Zulia, Ctr Invest Quim Prod Nat Dra Gladys Leon de Pinto, Fac Humanidades & Educ, Maracaibo, Venezuela",Consejo Superior de Investigaciones Cientificas (CSIC); CSIC - Centro de Investigaciones Biologicas (CIB),"Vera, A (corresponding author), Ctr Invest Biol, Lab Ecol, Madrid, Spain.",ajvera68@gmail.com,,,,,,,8,0,0,0,0,"UNIV ZULIA, FACULTAD AGRONOMIA",MARACAIBO,"APARTADO 15205, MARACAIBO, ZU 4005, VENEZUELA",0378-7818,2477-9407,,REV FAC AGRON LUZ,Rev. Fac. Agron.,JUL-SEP,2020,37,,,1,,,52,58,,,,,,7,Agronomy,Science Citation Index Expanded (SCI-EXPANDED),Agriculture,NH6YE,,,,,2023-05-23,WOS:000564812900009,View Full Record in Web of Science
J,"Sandner, TM; Schoppan, L; Matthies, D",,,,"Sandner, Tobias M.; Schoppan, Lola; Matthies, Diethart",,,"Seedlings of a hemiparasite recognize legumes, but do not distinguish good from poor host species",FOLIA GEOBOTANICA,,,English,Article,,,,,,Choice experiment; Host tropism; Hemiparasite; Haustorium; Rhinanthus alectorolophus; Anthoxanthum odoratum,RHINANTHUS-MINOR; ROOT HEMIPARASITE; PARASITIC PLANT; HAUSTORIA; GROWTH; PERFORMANCE; SELECTIVITY; ALLOCATION; HERBIVORE; BIOLOGY,"Most hemiparasitic plants are generalists with a broad host range, but they grow better in the presence of some plant species than with others. In mixed communities of hosts, hemiparasites prefer some hosts over others, but it is not yet known if hemiparasite roots can distinguish between the roots of different plant species and show directed growth (host tropism). We performed host choice experiments, exposing seedlings of Rhinanthus alectorolophus in agar plates simultaneously to seedlings of grass and legume species known to be hosts of good or poor quality for the parasite, and measured directed root growth and haustoria formation. Parasite roots did not show directed growth towards the roots of a good compared to a poor host species within a host functional group. However, parasite roots grew more strongly in the direction of legume than grass roots. The probability to form haustoria with host roots did not differ between host species, and microscopy revealed that functional haustoria were formed even with a very poor host, the grass Anthoxanthum odoratum. Our results show that growth experiments in agar plates are a suitable approach to study early host choice of hemiparasites. Our finding that hemiparasites can (initially) form functional haustoria even with very poor hosts emphasizes that the quality of a plant species as a host depends on several independent processes, including early host recognition, haustoria formation, resource supply and competition.","[Sandner, Tobias M.; Schoppan, Lola; Matthies, Diethart] Philipps Univ Marburg, Dept Biol, Plant Ecol, Karl von Frisch Str 8, D-35043 Marburg, Germany",Philipps University Marburg,"Sandner, TM (corresponding author), Philipps Univ Marburg, Dept Biol, Plant Ecol, Karl von Frisch Str 8, D-35043 Marburg, Germany.",tobias.sandner@biologie.uni-marburg.de,,,Projekt DEAL,Projekt DEAL,Open Access funding enabled and organized by Projekt DEAL.,,52,1,1,11,12,SPRINGER,DORDRECHT,"VAN GODEWIJCKSTRAAT 30, 3311 GZ DORDRECHT, NETHERLANDS",1211-9520,1874-9348,,FOLIA GEOBOT,Folia Geobot.,JUL,2022,57,2,,,,,117,126,,10.1007/s12224-022-09414-1,http://dx.doi.org/10.1007/s12224-022-09414-1,,JUL 2022,10,Plant Sciences,Science Citation Index Expanded (SCI-EXPANDED),Plant Sciences,4A3FN,,hybrid,,,2023-05-23,WOS:000828418400001,View Full Record in Web of Science
J,"Lu, JK; Li, ZS; Yang, FC; Wang, SK; Liang, JF; He, XH",,,,"Lu, J. K.; Li, Z. S.; Yang, F. C.; Wang, S. K.; Liang, J. F.; He, X. H.",,,Concurrent carbon and nitrogen transfer between hemiparasite Santalum album and two N-2-fixing hosts in a sandalwood plantation,FOREST ECOLOGY AND MANAGEMENT,,,English,Article,,,,,,Acacia confusa; Dalbergia odorifera; Haustorium; Herbaceous plants; Mixed plantations,DALBERGIA-ODORIFERA; EUCALYPTUS-GRANDIS; PARASITIC PLANTS; ACACIA-MANGIUM; R BR; ROOT; L.; LEGUME; SOIL; ASSOCIATION,"Root hemiparasites feed on host root xylem and prefer N-2-fixing hosts. Carbon (C) and nitrogen (N) translocation from hosts to hemiparasites affect growth and development, but detailed C and N economies between hemiparasites and N-2-fixing hosts are unknown. In a 6-year-old Santalum album (sandalwood) plantation, concurrent movement of C and N between plants over 14 days were traced among N-2-fixing Acacia confusa, N-2-fixing Dalbergia odorifera (rosewood) and non-N-2-fixing hemi-parasitic sandalwood by adding C-13-labeled and N-15-labeled urea to leaves of one species (donor) and tracing the label into other two species (receivers) within three triple-tree combinations. Haustorial connections and host selectivity were also examined on roots and nodules within adjacent plants. N-2 fixation by acacia and rosewood was quantified in the stand by N-15 natural abundance. Parasitic haustoria of sandalwood on roots and nodules of N-2-fixing acacia and rosewood were more frequent than on other non-N-2-fixing herbaceous plants, indicating strong host selectivity and preference. N-2 fixation supplied 19.7% and 52.3% of the total N in acacia and rosewood, respectively. During 14 days of labeling, more C-13 and N-15 was transferred from acacia or rosewood to sandalwood than from sandalwood to these two N-2 fixers. Net C and N transfer between tree pairs indicated that hemiparasite sandalwood was the C sink or N sink when associated with N-2-fixing acacia or rosewood, while N-2-fixing acacia was the C sink or N sink when associated with N-2-fixing rosewood. This study indicated that mixed plantations had high rates of interplant nutrient transfer. Our results also showed that the herbaceous plants might acquire some C and N from sandalwood and two N-2-fixing plants via both direct and indirect transfers, suggesting a nutrient translocafion between plants within this community. This mixed plantation of acacia/rosewood/sandalwood could replace low-valued single species or mixed plantations for growing both high-value sandalwood and rosewood heartwoods. Our study quantified nutrient transfer among plants in a sandalwood plantation. These results have improved our understanding of the physiological interactions in resource acquisition between host species and parasitic plants and provided insights into promising mixed-plantation patterns for valuable tropical trees in south China and globally.","[Lu, J. K.; Li, Z. S.; Yang, F. C.; Wang, S. K.; Liang, J. F.; He, X. H.] Chinese Acad Forestry, Res Inst Trop Forestry, State Key Lab Tree Genet & Breeding, Guangzhou 510520, Guangdong, Peoples R China; [He, X. H.] Univ Western Australia, Sch Biol Sci, Perth, WA 6009, Australia","Chinese Academy of Forestry; Research Institute of Tropical Forestry, CAF; State Key Laboratory of Tree Genetics & Breeding, CAF; University of Western Australia","Lu, JK; He, XH (corresponding author), Chinese Acad Forestry, Res Inst Trop Forestry, State Key Lab Tree Genet & Breeding, Guangzhou 510520, Guangdong, Peoples R China.",junkunlu@caf.ac.cn; xinhua.he@uwa.edu.au,"He, Xinhua/B-8047-2015","He, Xinhua/0000-0002-5570-3454; WANG, shengkun/0000-0002-2487-6344","National Natural Science Foundation of China [31670636, 31722012]",National Natural Science Foundation of China(National Natural Science Foundation of China (NSFC)),This study was financially supported by the National Natural Science Foundation of China (31670636 and 31722012).,,60,2,2,10,31,ELSEVIER,AMSTERDAM,"RADARWEG 29, 1043 NX AMSTERDAM, NETHERLANDS",0378-1127,1872-7042,,FOREST ECOL MANAG,For. Ecol. Manage.,MAY 15,2020,464,,,,,,,,118060,10.1016/j.foreco.2020.118060,http://dx.doi.org/10.1016/j.foreco.2020.118060,,,10,Forestry,Science Citation Index Expanded (SCI-EXPANDED),Forestry,LG6EI,,,,,2023-05-23,WOS:000528191300015,View Full Record in Web of Science
J,"PRESS, MC; PARSONS, AN; MACKAY, AW; VINCENT, CA; COCHRANE, V; SEEL, WE",,,,"PRESS, MC; PARSONS, AN; MACKAY, AW; VINCENT, CA; COCHRANE, V; SEEL, WE",,,GAS-EXCHANGE CHARACTERISTICS AND NITROGEN RELATIONS OF 2 MEDITERRANEAN ROOT HEMIPARASITES - BARTSIA-TRIXAGO AND PARENTUCELLIA-VISCOSA,OECOLOGIA,,,English,Article,,,,,,PHOTOSYNTHESIS; NITROGEN; PARASITIC ANGIOSPERM; GAS EXCHANGE; LEAF CONDUCTANCE,HOST-PARASITE ASSOCIATION; XYLEM-TAPPING MISTLETOES; STRIGA-HERMONTHICA; WATER RELATIONS; RHINANTHUS-MINOR; ISOTOPE RATIOS; CARBON; PHOTOSYNTHESIS; LEAVES; PLANTS,"Plant height, light-saturated rates of photosynthesis (A(max)) and foliar nitrogen concentration (N1) were measured for Bartsia trixago under field conditions in Mallorca. All three variables were postively correlated, and were also positively related to the abundance of nitrogen-fixing legumes in the associated vegetation (putative host species). A(max) for B. trixago ranged from 7.7 to 18.8 mumol m-2 s-1; similar rates were measured for a second hemiparasite Parentucellia viscosa, and both species were within the range of rates measured for six putative hosts (10.6-19.2 mumol m-2 s-1). Fertilization of unattached B. trixago plants with inorganic nitrogen (ammonium nitrate) elicited neither the growth nor the photosynthetic responses observed in plants considered to be parasitic on legumes and in receipt of an enriched organic nitrogen supply. Both hemiparasites had high diurnal leaf conductances (g(s)) (469-2291 mmol m-2 s-1) and were at the upper end of the range of those measured in putative hosts (409-879 mmol m-2 s-1). In contrast with the latter, high nocturnal rates of g, were also recorded for the two hemiparasites (517-1862 mmol m-2 s-1). There was no clear relationship between either A(max) or N1 and either g(s), transpiration (E) or water use efficiency (A(max)/E) in B. trixago plants. The economics of water loss appear to be independent of both the supply of nitrogen from the host and autotrophic carbon fixation.",,,"PRESS, MC (corresponding author), UNIV MANCHESTER,SCH BIOL SCI,DEPT ENVIRONM BIOL,MANCHESTER M13 9PL,LANCS,ENGLAND.",,"Press, Malcolm Colin/ABB-3995-2021",,,,,,40,30,30,1,14,SPRINGER VERLAG,NEW YORK,"175 FIFTH AVE, NEW YORK, NY 10010",0029-8549,,,OECOLOGIA,Oecologia,AUG,1993,95,1,,,,,145,151,,10.1007/BF00649518,http://dx.doi.org/10.1007/BF00649518,,,7,Ecology,Science Citation Index Expanded (SCI-EXPANDED),Environmental Sciences & Ecology,LR541,28313323,,,,2023-05-23,WOS:A1993LR54100020,View Full Record in Web of Science
J,"Robert, S; Simier, P; Fer, A",,,,"Robert, S; Simier, P; Fer, A",,,"Purification and characterization of mannose 6-phosphate reductase, a potential target for the control of Striga hermonthica and Orobanche ramosa",AUSTRALIAN JOURNAL OF PLANT PHYSIOLOGY,,,English,Article,,,,,,mannose 6-phosphate reductase; mannitol; Orobanche ramosa; parasitic angiosperms; Striga hermonthica,ROOT-HEMIPARASITIC ANGIOSPERM; THESIUM-HUMILE; GEL-ELECTROPHORESIS; TRANSGENIC TOBACCO; TRITICUM-VULGARE; MANNITOL; SANTALACEAE; EXPRESSION; METABOLISM; ENZYMES,"Mannose 6-phosphate reductase (M6PR, EC 1.1.1.224), a potential target for the chemical control of the parasitic angiosperms that produce mannitol, was purified from the photosynthetic parasite Striga hermonthica (Del.) Benth. and the achlorophyllous parasite Orobanche ramosa L. Except for the K-m values for NADPH, most of the characteristics of the enzymes are similar in these species, i.e. a monomeric structure of 38-39 kDa molecular mass, a pH optimum of 7.0-7.5 suggesting a cytosolic location, a relatively high optimum temperature (35-45 degrees C), a low K-m value for mannose 6-phosphate of 5.9-8.6 mM and, lastly, a significant preference for NADPH as nucleotidic cofactor.","Fac Sci & Tech, Grp Physiol & Pathol Vegetales, F-44322 Nantes, France",,"Simier, P (corresponding author), Fac Sci & Tech, Grp Physiol & Pathol Vegetales, BP 92208,2 Rue Houssiniere, F-44322 Nantes, France.",philippe.simier@nat.svt.sciences.univ-nantes.fr,,,,,,,25,14,14,0,4,CSIRO PUBLISHING,CLAYTON,"UNIPARK, BLDG 1, LEVEL 1, 195 WELLINGTON RD, LOCKED BAG 10, CLAYTON, VIC 3168, AUSTRALIA",0310-7841,,,AUST J PLANT PHYSIOL,Aust. J. Plant Physiol.,,1999,26,3,,,,,233,237,,10.1071/PP98138,http://dx.doi.org/10.1071/PP98138,,,5,Plant Sciences,Science Citation Index Expanded (SCI-EXPANDED),Plant Sciences,197QV,,,,,2023-05-23,WOS:000080377900004,View Full Record in Web of Science
J,"Tkach, N; Ree, RH; Kuss, P; Roser, M; Hoffmann, MH",,,,"Tkach, Natalia; Ree, Richard H.; Kuss, Patrick; Roeser, Martin; Hoffmann, Matthias H.",,,"High mountain origin, phylogenetics, evolution, and niche conservatism of arctic lineages in the hemiparasitic genus Pedicularis (Orobanchaceae)",MOLECULAR PHYLOGENETICS AND EVOLUTION,,,English,Article,,,,,,Pedicularis; Arctic; Biogeography; Ecology; Niche conservatism; Phylogeny,MULTIPLE LINEAGES; GLACIAL SURVIVAL; FLORAL DIVERSITY; RANGE SHIFTS; NORTH-POLE; PLANT; RANUNCULUS; PHYLOGEOGRAPHY; PATTERNS; HISTORY,"The origin of the arctic flora covering the northernmost treeless areas is still poorly understood. Arctic plants may have evolved in situ or immigrated from the adjacent ecosystems. Frequently arctic species have disjunctive distributions between the Arctic and high mountain systems of the temperate zone. This pattern may result from long distance dispersal or from glacial plant migrations and extinctions of intermediate populations. The hemiparasitic genus Pedicularis is represented in the Arctic by c. 28 taxa and ranks among the six most species-rich vascular plant genera of this region. In this study, we test the hypothesis that these lineages evolved from predecessors occurring in northern temperate mountain ranges, many of which are current centers of diversity for the genus. We generated a nuclear ribosomal and chloroplast DNA phylogeny including almost all of the arctic taxa and nearly half of the genus as a whole. The arctic taxa of Pedicularis evolved 12-14 times independently and are mostly nested in lineages that otherwise occur in the high mountains of Eurasia and North America. It appears that only three arctic lineages arose from the present-day center of diversity of the genus, in the Hengduan Mountains and Himalayas. Two lineages are probably of lowland origin. Arctic taxa of Pedicularis show considerable niche conservatism with respect to soil moisture and grow predominantly in moist to wet soils. The studied characteristics of ecology, morphology, and chromosome numbers of arctic Pedicularis show a heterogeneous pattern of evolution. The directions of morphological changes among the arctic lineages show opposing trends. Arctic taxa are chiefly diploid, the few tetraploid chromosome numbers of the genus were recorded only for arctic taxa. Five arctic Pedicularis are annuals or biennials, life forms otherwise rare in the Arctic. Other genera of the Orobanchaceae consist also of an elevated number of short-lived species, thus hemiparasitism may favor this life form in the Arctic. (C) 2014 Elsevier Inc. All rights reserved.","[Tkach, Natalia; Roeser, Martin; Hoffmann, Matthias H.] Univ Halle Wittenberg, Inst Biol, Geobot & Bot Garden, D-06108 Halle, Germany; [Ree, Richard H.] Field Museum Nat Hist, Dept Bot, Chicago, IL 60605 USA; [Kuss, Patrick] Inst Systemat Bot, CH-8008 Zurich, Switzerland",Martin Luther University Halle Wittenberg; Field Museum of Natural History (Chicago),"Hoffmann, MH (corresponding author), Univ Halle Wittenberg, Inst Biol, Geobot & Bot Garden, Kirchtor 3, D-06108 Halle, Germany.",natalia.tkach@botanik.uni-halle.de; rree@fieldmuseum.org; patrick.kuss@systbot.uzh.ch; martin.roeser@botanik.uni-halle.de; matthias.hoffmann@botanik.uni-halle.de,,"Tkach, Natalia/0000-0002-4627-0706; Kuss, Patrick/0000-0002-0302-6658",German Science Foundation [HO 2213/3-1]; US National Science Foundation [DEB-1119098]; European Union SYNTHESYS 2 Program; Stiftung zur Forderung der Pflanzenkenntnisse in Basel; Division Of Environmental Biology; Direct For Biological Sciences [1119098] Funding Source: National Science Foundation,German Science Foundation(German Research Foundation (DFG)); US National Science Foundation(National Science Foundation (NSF)); European Union SYNTHESYS 2 Program; Stiftung zur Forderung der Pflanzenkenntnisse in Basel; Division Of Environmental Biology; Direct For Biological Sciences(National Science Foundation (NSF)NSF - Directorate for Biological Sciences (BIO)),"We thank the curators of the herbaria of A, B, BASEL, BIL, BM, BNU, E, F, FRU, HAL, K, KUMA, LE, MICH, O, SZU, TI, W, WTU, WU, Z/ZT for their support. We thank the referees for their helpful comments. This work was supported by grants from the German Science Foundation (to N.T., M.R. & M.H.H., Project Number HO 2213/3-1), the US National Science Foundation (Grant DEB-1119098 to R.R. & P.K.), the European Union SYNTHESYS 2 Program (to P.K.), and the Stiftung zur Forderung der Pflanzenkenntnisse in Basel (to P.K.).",,106,33,36,3,108,ACADEMIC PRESS INC ELSEVIER SCIENCE,SAN DIEGO,"525 B ST, STE 1900, SAN DIEGO, CA 92101-4495 USA",1055-7903,1095-9513,,MOL PHYLOGENET EVOL,Mol. Phylogenet. Evol.,JUL,2014,76,,,,,,75,92,,10.1016/j.ympev.2014.03.004,http://dx.doi.org/10.1016/j.ympev.2014.03.004,,,18,Biochemistry & Molecular Biology; Evolutionary Biology; Genetics & Heredity,Science Citation Index Expanded (SCI-EXPANDED),Biochemistry & Molecular Biology; Evolutionary Biology; Genetics & Heredity,AI4FJ,24631857,Green Accepted,,,2023-05-23,WOS:000336820800008,View Full Record in Web of Science
