J,"Bullock, JM; Pywell, RF",,,,"Bullock, JM; Pywell, RF",,,Rhinanthus: A tool for restoring diverse grassland?,FOLIA GEOBOTANICA,,,English,Article; Proceedings Paper,1st International Symposium on the Biology of Non-Weedy Hemiparasitic (ex-) Scrophulariaceae,"APR 15-16, 2004","Wageningen, NETHERLANDS",,,biodiversity; competition; ecosystem function; facilitation; habitat creation; hemiparasite; parasitism,PARASITIC PLANT; ROOT HEMIPARASITES; FUNCTIONAL-ROLE; RESTORATION; MANAGEMENT; DISPERSAL; ANGUSTIFOLIUS; PRODUCTIVITY; COMMUNITY; IMPACT,"The restoration of species-rich grasslands is often hindered by high residual soil fertility as a result of, e.g., intensive farming. The establishment of a diverse range of target species on such sites requires the reduction of soil fertility or of the vigour of competitive plants. Current methods to achieve these aims are often unsuccessful or complicated and expensive. It has been suggested that Rhinanthus species could be used to decrease the growth of competitive plants and enhance species diversity. We review evidence for this potential and suggest five key attributes that make Rhinanthus species a practical restoration tool. Rhinanthus species are natural components of species-rich grasslands (attribute 1), and seed of some species is relatively low cost and easily obtainable (2). Recent work has shown that certain Rhinanthus species reduce the vigour of competitive species, especially agricultural grasses, and allow establishment and persistence of target species (3). We analyze demographic data and show that certain Rhinanthus species have the ability for rapid population growth and spread, even in fertile grasslands (4). We also show that it is relatively easy for land managers to limit the population size of Rhinanthus species and prevent damage (e.g. excessive loss in production or invasion by weeds) to grasslands by excessive densities (5). We give suggestions for further research, including: the range of species-poor grasslands into which Rhinanthus can be introduced successfully and which Rhinanthus species should be used; the mechanisms by which Rhinanthus enhances diversity in restored grasslands; whether the ecotype or subspecies of Rhinauthus used affects restoration success; how management methods affect population growth and spread of Rhinanthus; and whether other parasitic plants could be used in habitat restoration.","CEH Dorset, NERC, Ctr Ecol & Hydrol, Dorchester DT2 8ZD, Dorset, England; NERC, Ctr Ecol & Hydrol, Huntingdon PE28 2LS, Cambs, England",UK Centre for Ecology & Hydrology (UKCEH); UK Research & Innovation (UKRI); Natural Environment Research Council (NERC); UK Centre for Ecology & Hydrology (UKCEH); UK Research & Innovation (UKRI); Natural Environment Research Council (NERC),"Bullock, JM (corresponding author), CEH Dorset, NERC, Ctr Ecol & Hydrol, Dorchester DT2 8ZD, Dorset, England.",jmbul@ceh.ac.uk,"Bullock, James M/F-9997-2011; Pywell, Richard F/E-8738-2010","Pywell, Richard F/0000-0001-6431-9959",,,,,50,51,53,0,48,SPRINGER,DORDRECHT,"VAN GODEWIJCKSTRAAT 30, 3311 GZ DORDRECHT, NETHERLANDS",1211-9520,1874-9348,,FOLIA GEOBOT,Folia Geobot.,,2005,40,2-3,,,,,273,288,,10.1007/BF02803240,http://dx.doi.org/10.1007/BF02803240,,,16,Plant Sciences,Science Citation Index Expanded (SCI-EXPANDED); Conference Proceedings Citation Index - Science (CPCI-S),Plant Sciences,945YZ,,,,,2023-05-23,WOS:000230540200013,View Full Record in Web of Science
J,"Kelly, JF; Cartica, RJ; Van Clef, M",,,,"Kelly, Jay F.; Cartica, Robert J.; Van Clef, Michael",,,Long-term Monitoring and Management of American Chaffseed (Schwalbea americana) in the New Jersey Pine Barrens: Population Ecology of an Endangered Hemiparasite,NATURAL AREAS JOURNAL,,,English,Article,,,,,,dormancy; fire; individualistic studies; mowing; prescribed burning; rare plant conservation,DYNAMICS; DORMANCY; PLANTS; LONGEVITY; PROTOCOL; GROWTH; ORCHID,"We studied the long-term demographic structure of the endangered hemiparasitic plant, Schwalbea americana (American chaffseed), in the New Jersey Pine Barrens from 1991 to 2020 in order to address important questions about its population biology, life history, and responses to management. These included the relative contributions of dormancy, recruitment, and other life stages to annual population changes, as well as its ecological responses to fire, mowing, and other factors over time. Following baseline surveys in 1991, we conducted annual censuses from 1993 to 2020 and individualistic plant monitoring from 1999 to 2020. The Schwalbea population initially exhibited positive growth, with major increases observed in the early 2000s, followed by steady, long-term declines. We used generalized linear models and mixed effects models to analyze the relationships between demographic and environmental variables at the population and individual levels, respectively. Dormant season prescribed burning and mowing yielded significant increases in flowering, stems, and survival, with apparent residual benefits in subsequent years following repeated treatments. Germination declined to 0% after 4 y in seed viability experiments, and recruitment was more strongly correlated with estimated seed bank sizes than with flowering alone. Dormant plants represented an average of 21% of the total population, with 20% of above ground plants entering dormancy annually. Most dormancy events (92%) were 1-3 y in duration, indicating that mortality cannot be distinguished from dormancy for a minimum of 3 y after disappearance. Annual survivorship was high (mean = 88%), with 9% of individuals surviving 18 y on average, but differed significantly by cohort and increased with management. Significant differences were observed in size and flowering by age/stage class. However, size alone was insufficient to identify Schwalbea recruits from older plants, due to overlap of their lower size ranges. Long-term declines in survival and recruitment persisted despite suppression of woody succession by hand clipping and intermittent mowing and burning. Increased frequency of mowing or burning may be needed to sustain this population in the future. The relationships of growth and vital rates to other factors are provided, and the benefits of individualistic data for informing Schwalbea monitoring and management are discussed.","[Kelly, Jay F.; Cartica, Robert J.; Van Clef, Michael] NJ Dept Environm Protect, Off Nat Lands Management, Div Pk & Forestry, POB 420, Trenton, NJ 08625 USA; [Kelly, Jay F.] Raritan Valley Community Coll, Ctr Environm Studies, 118 Lamington Rd, North Branch, NJ 08876 USA; [Van Clef, Michael] Ecol Solut LLC, 9 Warren Lane, Great Meadows, NJ 07838 USA",,"Kelly, JF (corresponding author), NJ Dept Environm Protect, Off Nat Lands Management, Div Pk & Forestry, POB 420, Trenton, NJ 08625 USA.;Kelly, JF (corresponding author), Raritan Valley Community Coll, Ctr Environm Studies, 118 Lamington Rd, North Branch, NJ 08876 USA.",jkelly@raritanval.edu,,,"USFWS Wildlife and Sport Fish Restoration Program under Section 6 of the Endangered Species Act; NJDEP Office of Natural Lands Management; Raritan Valley Community College; 2020 USFWS Conservation Recovery Challenge Grant; Pinelands Preservation Alliance; Rutgers Graduate School of New Brunswick, Graduate Program in Ecology and Evolution; Rutgers Pinelands Research Station","USFWS Wildlife and Sport Fish Restoration Program under Section 6 of the Endangered Species Act; NJDEP Office of Natural Lands Management; Raritan Valley Community College; 2020 USFWS Conservation Recovery Challenge Grant; Pinelands Preservation Alliance; Rutgers Graduate School of New Brunswick, Graduate Program in Ecology and Evolution; Rutgers Pinelands Research Station","This research was funded by annual grants from the USFWS Wildlife and Sport Fish Restoration Program under Section 6 of the Endangered Species Act. Additional funding was provided by the NJDEP Office of Natural Lands Management, Raritan Valley Community College sabbatical awards (2013, 2020-2021), and a 2020 USFWS Conservation Recovery Challenge Grant in partnership with R. Rebozo and J. Rhoads (Pinelands Preservation Alliance). Partial support came from the Rutgers Graduate School of New Brunswick, Graduate Program in Ecology and Evolution, and the Rutgers Pinelands Research Station. Precipitation and temperature data were generously provided by D. Gray (Rutgers) and K. Clark (USDA Forest Service) at the Silas Little Experimental Forest. Field assistance was provided by J. Ray, R. Buczynski, N. Minicuci, P. Rivetti, D. Hardy, M. Palmer, M. Ezawa, M. Singer, K. Bassett, A. Zelesny, M. Scott, T. Hardy, B. Langston, D. LaPuma, R. Scagnelli, and M. Allen. Prescribed burns were conducted by the NJDEP Forest Fire Service and mowing by Brendan T. Byrne State Forest staff and M. Rapp (NJ Natural Lands Trust). NJDEP Division of Forestry staff, B. Zipse, S. Hensen, T. Wycoff, B. Isaacson, and J. Sacco as well as R. Rebozo (PPA) and E. DeVito, R. Juelg, and B. Scullion (NJ Conservation Foundation) assisted with vegetation management. Site history information was provided by D. Snyder, T. Gordon, and W. Bien. Administrative support was provided by D. Oliver, K. Walz, D. Gero, and D. Schapley. A. Zuur and E. Ieno (Highland Statistics LLC) provided invaluable assistance with using R for GLM and GLMM analyses. Thanks also to the two anonymous reviewers for their very helpful comments and suggestions.",,39,0,0,0,0,NATURAL AREAS ASSOC,ROCKFORD,"320 SOUTH THIRD ST, ROCKFORD, IL 61104 USA",0885-8608,2162-4399,,NAT AREA J,Nat. Areas J.,APR,2022,42,2,,,,,124,138,,10.3375/21-33,http://dx.doi.org/10.3375/21-33,,,15,Ecology; Forestry,Science Citation Index Expanded (SCI-EXPANDED),Environmental Sciences & Ecology; Forestry,3C1OA,,Bronze,,,2023-05-23,WOS:000828398800003,View Full Record in Web of Science
J,"Shen, H; Ye, W; Hong, L; Huang, H; Wang, Z; Deng, X; Yang, Q; Xu, Z",,,,"Shen, H; Ye, W; Hong, L; Huang, H; Wang, Z; Deng, X; Yang, Q; Xu, Z",,,Progress in parasitic plant biology: Host selection and nutrient transfer,PLANT BIOLOGY,,,English,Review,,,,,,Holoparasite; hemiparasite; obligate parasite; facultative parasite; resource capture,CUSCUTA-REFLEXA ROXB; SINK-STIMULATED PHOTOSYNTHESIS; NITRATE UPTAKE NITROGEN; LUPINUS-ALBUS L; GERMINATION STIMULANTS; STRIGA-HERMONTHICA; VIGNA-UNGUICULATA; CARBON RELATIONS; HAUSTORIUM DEVELOPMENT; ROOT HEMIPARASITE,"Host range varies widely among species of parasitic plants. Parasitic plants realize host selection through induction by chemical molecular signals, including germination stimulants and haustoria-inducing factors (HIFs). Research on parasitic plant biology has provided information on germination, haustorium induction, invasion, and haustorial structures and functions. To date, some molecular mechanisms have been suggested to explain how germination stimulants work, involving a chemical change caused by addition of a nucleophilic protein receptor, and direct or indirect stimulation of ethylene generation. Haustorium initiation is induced by HIFs that are generated by HIF-releasing enzymes from the parasite or triggered by redox cycling between electrochemical states of the inducers. Haustorium attachment is non-specific, however, the attachment to a host is facilitated by mucilaginous substances produced by haustorial hairs. Following the attachment, the intrusive cells of parasites penetrate host cells or push their way through the host epidermis and cortex between host cells, and some types of cell wall-degrading enzymes may assist in the penetration process. After the establishment of host-parasite associations, parasitic plants develop special morphological structures (haustoria) and physiological characteristics, such as high transpiration rates, high leaf conductance, and low water potentials in hemiparasites, for nutrient transfer and resource acquisition from their hosts. Therefore, they negatively affect the growth and development and even cause death of their hosts.","Chinese Acad Sci, S China Bot Garden, Guangzhou 510650, Peoples R China","Chinese Academy of Sciences; South China Botanical Garden, CAS","Ye, W (corresponding author), Chinese Acad Sci, S China Bot Garden, 732 Xingke Rd, Guangzhou 510650, Peoples R China.",why@scbg.ac.cn,"Shen, Hao/N-5869-2019","Shen, Hao/0000-0003-1321-9303",,,,,144,72,79,4,124,WILEY,HOBOKEN,"111 RIVER ST, HOBOKEN 07030-5774, NJ USA",1435-8603,1438-8677,,PLANT BIOLOGY,Plant Biol.,MAR,2006,8,2,,,,,175,185,,10.1055/s-2006-923796,http://dx.doi.org/10.1055/s-2006-923796,,,11,Plant Sciences,Science Citation Index Expanded (SCI-EXPANDED),Plant Sciences,025EH,16547862,,,,2023-05-23,WOS:000236247600001,View Full Record in Web of Science
J,"Woodall, GS; Robinson, CJ",,,,"Woodall, GS; Robinson, CJ",,,Natural diversity of Santalum spicatum host species in south-coast river systems and their incorporation into profitable and biodiverse revegetation,AUSTRALIAN JOURNAL OF BOTANY,,,English,Article; Proceedings Paper,Conference on Prospects for Biodiversity and Rivers in Salinising Landscapes,"OCT 20-27, 2002","ALBANY, AUSTRALIA","Cooperat Res Ctr Plant Based Management Dryland Salin,Ctr Excellence Nat Resource Management",,,TREES,"The commercially valuable root hemiparasite Santalum spicatum ( R. Br.) A. DC. ( sandalwood) once grew throughout the medium- to low- rainfall areas of the south- western agricultural region of Australia; however, this resource has been exhausted by over- exploitation and clearing for agriculture. There has been growing interest from the farming community and other investors in the development of a plantation Santalum spicatum industry in southern Western Australia. This study investigated the distribution of remnant S. spicatum within the Pallinup River catchment and assessed the risk of S. spicatum population decline due to salinity. The natural range of host species at different sites ( river catchments) across the south coast was also investigated. Remnant populations of S. spicatum within and adjacent to the Pallinup River catchment were small ( 1 - 70 trees) and highly fragmented. The risk of further population decline due to salinity was concluded to be small because remnant trees were generally growing in well drained, sandy soils that were elevated above ( median 9 m) their immediate drainage line. Across the seven river catchments surveyed, S. spicatum occurred in a range of vegetation associations and parasitised numerous species ( 68) from a wide range of genera and families. The suite of species exploited varied within and between catchments. Thirty species, including most monocots and Myrtaceae, were not successfully parasitised. Remnant S. spicatum always occurred on well drained soil types that supported open- woodland or mallee - heath communities. Sandalwood plantations, supported by numerous individuals of a range of host species ( 10 - 40 species), were shown to be productive in terms of sandalwood growth. The scale of the developing sandalwood plantation industry is likely to be small and unlikely to cover large areas of catchments. Thus, this industry alone is unlikely to address the salinity crisis through broadscale recharge management. However, additional to on- site recharge reduction, biodiverse host plantations may improve the prospects for biodiversity and rivers in salinising landscapes through the protection and enhancement of natural biodiversity, creation of new habitat, conservation of plant species and by providing a commercial incentive to protect biodiversity.","Ctr Excellence Nat Resource Management, Albany, WA 6330, Australia; Greening Australia Western Australia Inc, Albany, WA 6330, Australia",University of Western Australia,"Woodall, GS (corresponding author), Ctr Excellence Nat Resource Management, 444 Albany Highway, Albany, WA 6330, Australia.",,,,,,,,21,11,11,1,8,C S I R O PUBLISHING,COLLINGWOOD,"150 OXFORD ST, PO BOX 1139, COLLINGWOOD, VICTORIA 3066, AUSTRALIA",0067-1924,,,AUST J BOT,Aust. J. Bot.,,2003,51,6,,,,,741,753,,10.1071/BT02118,http://dx.doi.org/10.1071/BT02118,,,13,Plant Sciences,Conference Proceedings Citation Index - Science (CPCI-S); Science Citation Index Expanded (SCI-EXPANDED),Plant Sciences,750FG,,,,,2023-05-23,WOS:000186980200014,View Full Record in Web of Science
J,"Ter Borg, SJ",,,,"Ter Borg, SJ",,,Dormancy and germination of six Rhinanthus species in relation to climate,FOLIA GEOBOTANICA,,,English,Article; Proceedings Paper,1st International Symposium on the Biology of Non-Weedy Hemiparasitic (ex-) Scrophulariaceae,"APR 15-16, 2004","Wageningen, NETHERLANDS",,,after-ripening; cold stratification; low temperature; Orobanchaceae; Scrophulariaceae; secondary dormancy,CHALK-GRASSLAND; SCROPHULARIACEAE; SEED; DEMOGRAPHY; ECOLOGY,"The genus Rhinanthus (Orobanchaceae) consists of annual hemiparasites that occur in a wide range of climates. Patterns of dormancy and germination were studied for six species sampled in areas ranging from the Pyrenees to Northern Scandinavia, and from sea level up to about 2500 in altitude in the Alpine region. Dormancy was broken by a 2 to 6 months period of cold stratification. Optimal temperature and length of the stratification period appeared to vary between and within species. Two patterns of dormancy and germination were distinguished. Seeds of the first group, including the widely distributed R. minor and R. angustifolius, further referred to as the LW group, require a relatively long period of cold stratification. Moreover, their germination is accelerated if they are subjected to a widening range of higher temperatures in the last weeks of the stratification period. In the other species (R. alectorolophus, R. glacialis, R. mediterraneus and perhaps R. antiquus) the release of dormancy is completed in a rather short period. Higher temperatures in the last weeks of the stratification period hardly affect the germination process of this SN-group, with short dormancy and no accelerated germination at higher temperatures. In both groups, temperatures above the low values during stratification reduce germination percentages and induce secondary dormancy in non-germinated seeds. The effects strongly vary with timing and temperature. The patterns have a genetic basis and seem to be species-specific. They do not vary with climate conditions, since samples R. minor, whether collected in sub-arctic or sub-alpine areas or at sea level, generally react according to the LW pattern, and samples of R. alectorolophus from areas at sea level up to montane regions according to the SN one. The ecological significance of the various stratification requirements and effects of higher temperatures on germination is discussed in relation to the local climate of the species and the evolutionary history of the genus.","Univ Wageningen & Res Ctr, Dept Environm Sci, Grp Nat Conservat & Plant Ecol, NL-6708 PD Wageningen, Netherlands",Wageningen University & Research,"Ter Borg, SJ (corresponding author), Hamelakkerlaan 11, NL-6703 EE Wageningen, Netherlands.",s.terborg@planet.nl,,,,,,,40,29,34,1,35,ACAD SCI CZECH REPUBLIC INST BOTANY,PRAGUE,"PRUHONICE NEAR PRAHA, PRAGUE 252 43, CZECH REPUBLIC",0015-5551,,,FOLIA GEOBOT,Folia Geobot.,,2005,40,2-3,,,,,243,260,,10.1007/BF02803238,http://dx.doi.org/10.1007/BF02803238,,,18,Plant Sciences,Conference Proceedings Citation Index - Science (CPCI-S); Science Citation Index Expanded (SCI-EXPANDED),Plant Sciences,945YZ,,,,,2023-05-23,WOS:000230540200011,View Full Record in Web of Science
J,"Mateo-Cid, LE; Mendoza-Gonzalez, AC; Searles, RB",,,,"Mateo-Cid, Luz Elena; Mendoza-Gonzalez, A. Catalina; Searles, Richard B.",,,A checklist and seasonal account of the deepwater Rhodophyta around Cozumel island on the Caribbean coast of Mexico,CARIBBEAN JOURNAL OF SCIENCE,,,English,Article,,,,,,marine algae; benthic algae; red algae,MARINE-ALGAE; SP-NOV; CERAMIACEAE; RECORDS,"Red seaweeds were investigated, using SCUBA, from waters around the island of Cozumel off the east coast of the Yucatan Peninsula in Mexico. One hundred and eighteen species of Rhodophyta were collected and identified. Forty-five of these are reported for the first time from Cozumel, and of these 11 are new records for Mexico. There was a distinct change in the deep water flora between wet and dry seasons; the dry season had more species with northern ranges in comparison with the flora in general. The wet season had few north-ranging species. Fifty-four epiphytic or hemiparasitic species were identified, most frequently on Halimeda tuna, Dictyota cervicornis and Sargassum spp. This account brings the total macroalgal taxa reported from Cozumel to 385, the richest flora of any locality in the Caribbean region of Mexico.","IPN, Escuela Nacl Ciencias Biol, Lab Ficol, Dept Bot, Mexico City 11340, DF, Mexico; Duke Univ, Dept Biol, Durham, NC 27708 USA",Instituto Politecnico Nacional - Mexico; Duke University,"Mateo-Cid, LE (corresponding author), IPN, Escuela Nacl Ciencias Biol, Lab Ficol, Dept Bot, Prol Carpio & Plan Ayala, Mexico City 11340, DF, Mexico.",lmateoc@ipn.mx,"Mateo-Cid, Luz Elena/HNR-5143-2023","Mateo-Cid, Luz Elena/0000-0001-7585-4826",,,,,65,13,17,0,2,UNIV PUERTO RICO,MAYAGUEZ,"COLLEGE ARTS SCIENCES, MAYAGUEZ, PR 00680 USA",0008-6452,,,CARIBB J SCI,Caribb. J. Sci.,,2006,42,1,,,,,39,52,,,,,,14,Biodiversity Conservation,Science Citation Index Expanded (SCI-EXPANDED),Biodiversity & Conservation,058OI,,,,,2023-05-23,WOS:000238673900005,View Full Record in Web of Science
J,"Dunwiddie, PW; Martin, RA",,,,"Dunwiddie, Peter W.; Martin, R. Adam",,,Microsites Matter: Improving the Success of Rare Species Reintroductions,PLOS ONE,,,English,Article,,,,,,,CASTILLEJA-LEVISECTA; GOLDEN PAINTBRUSH; PACIFIC-NORTHWEST; ENDANGERED PLANTS; PARASITIC PLANT; GRANDIFLORA; POPULATION; RHINANTHUS; ECOSYSTEMS; RANGE,"Our study was undertaken to better understand how to increase the success rates of recovery plantings of a rare hemiparasite, golden paintbrush (Castilleja levisecta-Orobanchaceae). This species is endemic to westernWashington and Oregon, USA, and southwestern British Columbia, Canada. Over 5000 golden paintbrush plants were outplanted as plugs in 2007 at six different native prairie sites that were considered to be suitable habitat, based on general evaluations of vegetation and soil conditions. Outplantings were installed at regular intervals along transects up to 1 km long to include a range of conditions occurring at each site. All plantings were re-examined five years later. The patchy distribution of surviving plugs and new recruits within each reintroduction site suggested success is strongly influenced by microsite characteristics. Indicator species analysis of taxa growing in microsites around outplanted golden paintbrush identified species that were positively or negatively associated with paintbrush survival. Species such as Festuca roemeri, Eriophyllum lanatum, and Viola adunca were strong indicators at some sites; non-natives such as Hypochaeris radicata and Teesdalia nudicaulis tended to be frequent negative indicators. Overall, higher richness of native perennial forbs was strongly correlated with both survival and flowering of golden paintbrush, a pattern that may reflect interactions of this hemiparasite with the immediately surrounding plant community. Topographic position also influenced outcomes, with greater survival occurring on mounds and in swales, where soils generally were deeper. Our findings suggest that assessments of site suitability based on vegetation alone, and coarser, site-level assessments that do not characterize heterogeneity at the microsite scale, may not be strong predictors of restoration success over the longer term and in sites with variability in vegetation and soils. By identifying suitable microsites to focus rare species plantings, survival and efficiency may be significantly enhanced.","[Dunwiddie, Peter W.; Martin, R. Adam] Ctr Nat Lands Management, Olympia, WA USA",,"Dunwiddie, PW (corresponding author), Ctr Nat Lands Management, Olympia, WA USA.",pdunwidd@u.washington.edu,"Dunwiddie, Peter/Q-7709-2016","Dunwiddie, Peter/0000-0002-7254-0423",United States Fish and Wildlife Service [F13AC00259],United States Fish and Wildlife Service(US Fish & Wildlife Service),"Financial support to carry out this study was provided through grant F13AC00259 to the Pacific Rim Institute for Environmental Stewardship from the United States Fish and Wildlife Service (http://www.fws.gov) for the recovery of golden paintbrush. Institutional support was provided by The Center for Natural Lands Management and The Nature Conservancy. The funders had no role in study design, data collection and analysis, decision to publish, or preparation of the manuscript. Both PWD and RAM received funding to carry out this study. There was no additional external funding received for this study.",,37,18,19,2,50,PUBLIC LIBRARY SCIENCE,SAN FRANCISCO,"1160 BATTERY STREET, STE 100, SAN FRANCISCO, CA 94111 USA",1932-6203,,,PLOS ONE,PLoS One,MAR 1,2016,11,3,,,,,,,e0150417,10.1371/journal.pone.0150417,http://dx.doi.org/10.1371/journal.pone.0150417,,,17,Multidisciplinary Sciences,Science Citation Index Expanded (SCI-EXPANDED),Science & Technology - Other Topics,DF5ZW,26930510,"gold, Green Published, Green Submitted",,,2023-05-23,WOS:000371434500144,View Full Record in Web of Science
