Publication Type,Authors,Book Authors,Book Editors,Book Group Authors,Author Full Names,Book Author Full Names,Group Authors,Article Title,Source Title,Book Series Title,Book Series Subtitle,Language,Document Type,Conference Title,Conference Date,Conference Location,Conference Sponsor,Conference Host,Author Keywords,Keywords Plus,Abstract,Addresses,Affiliations,Reprint Addresses,Email Addresses,Researcher Ids,ORCIDs,Funding Orgs,Funding Name Preferred,Funding Text,Cited References,Cited Reference Count,"Times Cited, WoS Core","Times Cited, All Databases",180 Day Usage Count,Since 2013 Usage Count,Publisher,Publisher City,Publisher Address,ISSN,eISSN,ISBN,Journal Abbreviation,Journal ISO Abbreviation,Publication Date,Publication Year,Volume,Issue,Part Number,Supplement,Special Issue,Meeting Abstract,Start Page,End Page,Article Number,DOI,DOI Link,Book DOI,Early Access Date,Number of Pages,WoS Categories,Web of Science Index,Research Areas,IDS Number,Pubmed Id,Open Access Designations,Highly Cited Status,Hot Paper Status,Date of Export,UT (Unique WOS ID),Web of Science Record
J,"Helton, RC; Kirkman, LK; Musselman, LJ",,,,"Helton, RC; Kirkman, LK; Musselman, LJ",,,Host preference of the federally endangered hemiparasite Schwalbea americana L. (Scrophulariaceae),JOURNAL OF THE TORREY BOTANICAL SOCIETY,,,English,Article,,,,,,Schwalbea americana; hemiparasite; endangered species; host preference; optimal host; Scrophulariaceae,PLANT; PHYSIOLOGY; GROWTH,"We examined the host-preference and optimal hosts of the federally endangered hemiparasite, Schwalbea americana L. We also determined the effects of four fertilizer treatments (NO3-140ppmN, NO3-280ppmN, NH4-140ppmN, and NH4-280ppmN) on the formation of haustoria of S. americana to two of these host species, Panicum tenue and Pityopsis graminifolia. Results of the host preference study show that Schwalbea americana seedlings are more likely to form haustorial connections with Pityopsis graminifolia and Ilex glabra than with other common associates. We also found that size of Schwalbea americana seedlings played an important role in year to year survivorship independent of host attachment. Regardless of nitrogen form, we observed a greater rate of attachment of Schwalbea americana to Pityopsis graminifolia than to Panicum tenue. Nitrogen treatment had no effect on parasitism of Panicum tenue, although more seedlings of Schwalbea americana survived without haustoria with the NH4-280ppm treatment. Growth (leaf area and stem height) of Schwalbea americana increased with NH4-280 ppm treatment with Pityopsis graminifolia as a host. Panicum tenue had much higher nitrate reductase activity levels in the leaf tissue than Pityopsis graminifolia, and both hosts showed low levels in the root tissue. Low levels of nitrate reductase activity were found in the leaves of Schwalbea americana. Host preference of Schwalbea americana may be related to the host's ability to utilize NH4 as opposed to its ability to reduce NO3. Growth of Schwalbea americana appears to be influenced by the amount of NH4 available to the host.","JW Jones Ecol Res Ctr, Newton, GA USA; Old Dominion Univ, Dept Biol, Norfolk, VA 23508 USA",Old Dominion University,"Helton, RC (corresponding author), Atlanta Bot Garden, 1345 Piedmont Ave NE, Atlanta, GA 30309 USA.",,,,,,,,22,6,6,0,10,TORREY BOTANICAL SOCIETY,LAWRENCE,"810 EAST 10TH ST, LAWRENCE, KS 66044 USA",0040-9618,,,J TORREY BOT SOC,J. Torrey Bot. Soc.,OCT-DEC,2000,127,4,,,,,300,306,,10.2307/3088648,http://dx.doi.org/10.2307/3088648,,,7,Plant Sciences,Science Citation Index Expanded (SCI-EXPANDED),Plant Sciences,382AC,,,,,2023-05-23,WOS:000165795400005,View Full Record in Web of Science
J,"Watson, DM; Milner, KV; Leigh, A",,,,"Watson, David M.; Milner, Kirsty V.; Leigh, Andrea",,,Novel application of species richness estimators to predict the host range of parasites,INTERNATIONAL JOURNAL FOR PARASITOLOGY,,,English,Article,,,,,,Host range; Host specificity; Sampling; Results-based stopping rule; Parasitic plant; Mistletoe,LYSIANA-EXOCARPI; GEOGRAPHIC RANGE; BIRD COMMUNITIES; SOUTH-AUSTRALIA; SAMPLING EFFORT; NEW-ZEALAND; SPECIFICITY; MISTLETOES; PERFORMANCE; PREVALENCE,"Host range is a critical life history trait of parasites, influencing prevalence, virulence and ultimately determining their distributional extent. Current approaches to measure host range are sensitive to sampling effort, the number of known hosts increasing with more records. Here, we develop a novel application of results-based stopping rules to determine how many hosts should be sampled to yield stable estimates of the number of primary hosts within regions, then use species richness estimation to predict host ranges of parasites across their distributional ranges. We selected three mistletoe species (hemiparasitic plants in the Loranthaceae) to evaluate our approach: a strict host specialist (Amyema lucasii, dependent on a single host species), an intermediate species (Amyema quandang, dependent on hosts in one genus) and a generalist (Lysiana exocarpi, dependent on many genera across multiple families), comparing results from geographically-stratified surveys against known host lists derived from herbarium specimens. The results-based stopping rule (stop sampling bioregion once observed host richness exceeds 80% of the host richness predicted using the Abundance-based Coverage Estimator) worked well for most bioregions studied, being satisfied after three to six sampling plots (each representing 25 host trees) but was unreliable in those bioregions with high host richness or high proportions of rare hosts. Although generating stable predictions of host range with minimal variation among six estimators tri-ailed, distribution-wide estimates fell well short of the number of hosts known from herbarium records. This mismatch, coupled with the discovery of nine previously unrecorded mistletoe-host combinations, further demonstrates the limited ecological relevance of simple host-parasite lists. By collecting estimates of host range of constrained completeness, our approach maximises sampling efficiency while generating comparable estimates of the number of primary hosts, with broad applicability to many host parasite systems. (C) 2016 Australian Society for Parasitology. Published by Elsevier Ltd. All rights reserved.","[Watson, David M.] Charles Sturt Univ, Sch Environm Sci, Albury, NSW 2640, Australia; [Milner, Kirsty V.; Leigh, Andrea] Univ Technol Sydney, Sch Life Sci, 15 Broadway, Ultimo 2007, Australia",Charles Sturt University; University of Technology Sydney,"Watson, DM (corresponding author), Charles Sturt Univ, Sch Environm Sci, Albury, NSW 2640, Australia.",dwatson@csu.edu.au,"Leigh, Andy/P-7374-2019; Leigh, Andy/F-2043-2017","Leigh, Andy/0000-0003-3568-2606; Leigh, Andy/0000-0003-3568-2606; David, Watson/0000-0003-1821-4632; Milner, Kirsty/0000-0001-8458-6253",,,,,63,9,9,0,25,ELSEVIER SCI LTD,OXFORD,"THE BOULEVARD, LANGFORD LANE, KIDLINGTON, OXFORD OX5 1GB, OXON, ENGLAND",0020-7519,1879-0135,,INT J PARASITOL,Int. J. Parasit.,JAN,2017,47,1,,,,,31,39,,10.1016/j.ijpara.2016.10.001,http://dx.doi.org/10.1016/j.ijpara.2016.10.001,,,9,Parasitology,Science Citation Index Expanded (SCI-EXPANDED),Parasitology,EK4ZP,27899327,,,,2023-05-23,WOS:000393937000004,View Full Record in Web of Science
J,"Atencio, NO; Vidal-Russell, R; Chacoff, N; Amico, GC",,,,"Atencio, N. O.; Vidal-Russell, R.; Chacoff, N.; Amico, G. C.",,,Host range dynamics at different scales: host use by a hemiparasite across its geographic distribution,PLANT BIOLOGY,,,English,Article,,,,,,bipartite network; host range; Loranthaceae; mistletoe; parasitic plants; South America; Tristerix,TRISTERIX-CORYMBOSUS; POPULATION-STRUCTURE; ECOLOGICAL NETWORKS; MISTLETOE; SPECIFICITY; PARASITES; ROLES; CONSEQUENCES; LORANTHACEAE; NESTEDNESS,"The complexity of natural communities is the result of interactions among species that coexist within them. Parasitic interactions are among the most common species interaction types, and analysis of parasite-host ranges can advance understanding of how host-parasite pairs structure community interactions across their geographic distributions. Using network analysis and host preference relative index, we analysed host use by the South American mistletoe, Tristerix corymbosus (Loranthaceae), in 22 localities among two biomes: Chilean matorral and temperate forest. The total number of host species recorded was 27, and 40% of these species were non-native. The non-native Populus sp. was shared between biomes. There was a positive relationship between host range and potential host species richness at the studied localities. On average, the mistletoe parasitized each host species relative to its abundance. However, some host species in some localities are more parasitized than expected. Network structure showed a differences in host use between the two biomes: Aristotelia chilensis was central in the temperate forest, with Populus sp. in the Chilean matorral. Host use intensity in the Chilean matorral was higher for non-native species. Tristerix corymbosus has a wide host range and could be considered a generalist parasite across its full geographic distribution, but at local scales, host preferences differed among localities and are related to host coverage. Alterations in community composition, due to natural events or human activities, can modify the availability of possible hosts. Hence, the mistletoe with the described characteristics may be able to change its infection preference while maintaining the interaction functionality.","[Atencio, N. O.; Vidal-Russell, R.; Amico, G. C.] Univ Nacl Comahue, CONICET, INIBIOMA, Lab Ecotono, Quintral 1250, RA-8400 San Carlos De Bariloche, Rio Negro, Argentina; [Chacoff, N.] Univ Nacl Tucuman, CONICET, Inst Ecol Reg, CC 34 Yerba Buena, RA-4107 San Miguel De Tucuman, Argentina; [Chacoff, N.] Univ Nacl Tucuman, Fac Ciencias Nat, Miguel Lillo 205, RA-4000 San Miguel De Tucuman, Argentina; [Chacoff, N.] Univ Nacl Tucuman, Inst Miguel Lillo, Miguel Lillo 205, RA-4000 San Miguel De Tucuman, Argentina",Consejo Nacional de Investigaciones Cientificas y Tecnicas (CONICET); Universidad Nacional del Comahue; Consejo Nacional de Investigaciones Cientificas y Tecnicas (CONICET); Universidad Nacional de Tucuman; Universidad Nacional de Tucuman; Miguel Lillo Foundation; Universidad Nacional de Tucuman,"Atencio, NO (corresponding author), Univ Nacl Comahue, CONICET, INIBIOMA, Lab Ecotono, Quintral 1250, RA-8400 San Carlos De Bariloche, Rio Negro, Argentina.",nelsonatencio@comahue-conicet.gob.ar,"Amico, Guillermo C c/HGD-9402-2022","Chacoff, Natacha/0000-0002-1115-6989; Atencio, nelson omar/0000-0003-2307-7636; Amico, Guillermo/0000-0002-3709-3111",ANPCT-FONCYT [PICT-2017-2328]; CONICET,ANPCT-FONCYT; CONICET(Consejo Nacional de Investigaciones Cientificas y Tecnicas (CONICET)),"We thank M. Rodriguez Cabal and L. Amico for help in the field. The authors also thank J. Rudgers for helpful comments and improvement to English and the reviewers who greatly improved the manuscript. We also thank Corporacion Nacional Forestal (Chile), University Austral and Parques Nacionales (Argentina) for granting permits to work in some populations. Funding was provided by ANPCT-FONCYT (PICT-2017-2328) to GCA and RVR. RVR, NC and GCA are career researchers with the National Research Council of Argentina (CONICET) and NOA holds a doctoral scholarship from CONICET.",,55,3,3,0,14,WILEY,HOBOKEN,"111 RIVER ST, HOBOKEN 07030-5774, NJ USA",1435-8603,1438-8677,,PLANT BIOLOGY,Plant Biol.,JUL,2021,23,4,,,,,612,620,,10.1111/plb.13264,http://dx.doi.org/10.1111/plb.13264,,MAY 2021,9,Plant Sciences,Science Citation Index Expanded (SCI-EXPANDED),Plant Sciences,SO9WD,33774885,,,,2023-05-23,WOS:000649401300001,View Full Record in Web of Science
J,"Ren, YQ; Guan, KY; Li, AR; Hu, XJ; Zhang, L",,,,"Ren, Yong-Quan; Guan, Kai-Yun; Li, Ai-Rong; Hu, Xiao-Jian; Zhang, Le",,,"Host Dependence and Preference of the Root Hemiparasite, Pedicularis cephalantha Franch. (Orobanchaceae)",FOLIA GEOBOTANICA,,,English,Article,,,,,,Alpine plant; Haustorium; Host-parasite interaction; Host specificity; Propagation,PLANT RHINANTHUS-MINOR; PARASITIC PLANTS; SEED-GERMINATION; GRASSLAND; GROWTH; ESTABLISHMENT; HAUSTORIA; CHINA; SCROPHULARIACEAE; COMMUNITIES,"The interaction between parasitic plants and their hosts is an important topic in both agriculture and ecology. Little, however, is known about that of the hemiparasite Pedicularis. It is essential to understand the host dependence and preference of Pedicularis for successful cultivation of plants in this genus and for understanding the roles they play in natural communities. We tested the effects of two herbaceous host species (Trifolium repens and Polypogon monspeliensis) on the survival and growth performance of Pedicularis cephalantha. Five P. cephalantha seedlings and two host plants were planted in each pot. In the control, no host plants were planted (treatment 1). Host plants were planted in three combinations: only T. repens (treatment 2) or P. monspeliensis (treatment 3) or a mixture of both (treatment 4). The results showed that P. cephalantha performed better in the presence of host plants, and host plants are more essential to P. cephalantha for proper development than for survival. The grass host P. monspeliensis proved to be a better host plant for P. cephalantha than the legume host T. repens. The high dependence of P. cephalantha on host plants and its host preference were demonstrated in this study. This is the first report of the performance of Chinese Pedicularis species in cultivation throughout all life stages (from seeds to seeds).","[Ren, Yong-Quan; Guan, Kai-Yun; Li, Ai-Rong; Hu, Xiao-Jian; Zhang, Le] Chinese Acad Sci, Kunming Inst Bot, Kunming 650204, Yunnan, Peoples R China; [Ren, Yong-Quan; Hu, Xiao-Jian; Zhang, Le] Chinese Acad Sci, Grad Sch, Beijing 100039, Peoples R China","Chinese Academy of Sciences; Kunming Institute of Botany, CAS; Chinese Academy of Sciences; University of Chinese Academy of Sciences, CAS","Guan, KY (corresponding author), Chinese Acad Sci, Kunming Inst Bot, Kunming 650204, Yunnan, Peoples R China.",guanky@mail.kib.ac.cn,"Li, Ai-Rong/M-1858-2013","Li, Ai-Rong/0000-0002-6134-9471; Ren, Yongquan/0000-0002-0129-435X","National Natural Science Foundation of China [30670207, 30970288]; National Natural Science Foundation of Yunnan Province [2009CD114]; Chinese Academy of Sciences",National Natural Science Foundation of China(National Natural Science Foundation of China (NSFC)); National Natural Science Foundation of Yunnan Province; Chinese Academy of Sciences(Chinese Academy of Sciences),"We are grateful to Jing-Xiu Li, Xue-Qing Yin, Nan Jiang and Li-Hua Yang from KIB for their assistance with experiments. We thank Ms. Margaret Cargill and Dr. Patrick O'Connor of the University of Adelaide, Ms. Juliet Nadeau Lu, Mr. Sailesh Ranjitkar and Mr. Anup Sharma from KIB for their critical reading of our early draft. We also thank the anonymous reviewers whose comments significantly improved the manuscript. This research was financially supported by the National Natural Science Foundation of China (Grant No. 30670207 and 30970288), the National Natural Science Foundation of Yunnan Province (Grant No. 2009CD114), and a Western Light Talent Training Program of the Chinese Academy of Sciences for Ai-Rong Li.",,46,18,23,2,48,SPRINGER,DORDRECHT,"VAN GODEWIJCKSTRAAT 30, 3311 GZ DORDRECHT, NETHERLANDS",1211-9520,,,FOLIA GEOBOT,Folia Geobot.,DEC,2010,45,4,,,,,443,455,,10.1007/s12224-010-9081-6,http://dx.doi.org/10.1007/s12224-010-9081-6,,,13,Plant Sciences,Science Citation Index Expanded (SCI-EXPANDED),Plant Sciences,691SU,,,,,2023-05-23,WOS:000285101900007,View Full Record in Web of Science
J,"Ewald, NC; John, EA; Hartley, SE",,,,"Ewald, Naomi C.; John, Elizabeth A.; Hartley, Susan E.",,,Responses of insect herbivores to sharing a host plant with a hemiparasite: impacts on preference and performance differ with feeding guild,ECOLOGICAL ENTOMOLOGY,,,English,Article,,,,,,Aphid; grass; grasshopper; hemiparasite; indirect; performance; preference; Spittle bug,ANGIOSPERM RHINANTHUS-MINOR; SCHISTOCERCA-GREGARIA; HOMOPTERA-CERCOPIDAE; PARASITIC PLANTS; DROUGHT STRESS; PHLOEM-SAP; XYLEM; APHID; PHOTOSYNTHESIS; GRASSHOPPER,"1. Root hemiparasites are common components of many ecosystems and can affect both the biomass and the nutritional quality of the plants they infect. The consequences of these modifications for the preference and performance of three herbivore feeding guilds sharing a host with the hemi-parasite were examined. 2. It was predicted that as the hemiparasite increased in biomass its impact on the host would increase, as would the indirect impacts on the herbivores. It was also predicted that herbivores from different feeding guilds would respond differently to the presence of the hemiparasite, reflecting the extent to which they utilise resources disrupted by the parasite and hence are in competition with it. 3. The preference and performance of phloem-feeding aphids, xylem-feeding spittle bugs, and leaf-feeding grasshoppers were measured on the host grass species, Holcus lanatus L. (Poaceae), with and without attachment from the hemi-parasite, Rhinanthus minor L. (Orobanchaceae). 4. The effects of R. minor on the host were dependent on the hemiparasite's stage of growth, being most pronounced when it was at peak biomass. At this stage it caused a significant reduction in the biomass, water content, and total nitrogen content of the host plants. 5. Overall, herbivores benefited from, or preferred, shared host plants more than uninfected plants. The aphid benefited from sharing a host with R. minor, showing increased population growth on, and preference for, parasitised plants. The spittle bug also showed a preference for parasitised plants. The grasshopper, Chorthippus brunneus Thunberg (Orthoptera: Acrididae), did not show a preference for, or a performance response to, parasitised hosts, but it consumed significantly more plant material when caged on parasitised plants. 6. These data support the prediction that invertebrate herbivores responded to changes in host plant traits driven by the hemiparasite, and strongly suggest that these indirect interactions could impact on population and community processes within natural communities.","[John, Elizabeth A.] Lincoln Univ, Dept Biol Sci, Fac Agr Food & Anim Sci, Lincoln LN2 2LG, England; [Ewald, Naomi C.; John, Elizabeth A.; Hartley, Susan E.] Univ Sussex, Sch Life Sci, Brighton, E Sussex, England; [Hartley, Susan E.] Univ York, Dept Biol, York YO10 5DD, N Yorkshire, England",University of Lincoln; RLUK- Research Libraries UK; University of Sussex; N8 Research Partnership; RLUK- Research Libraries UK; White Rose University Consortium; University of York - UK,"John, EA (corresponding author), Lincoln Univ, Dept Biol Sci, Fac Agr Food & Anim Sci, Riseholme Pk, Lincoln LN2 2LG, England.",ljohn@lincoln.ac.uk,,"John, Elizabeth/0000-0001-9281-536X; Hartley, Sue/0000-0002-5117-687X",Natural Environment Research Council [NE/D012333/1]; Natural Environment Research Council [NE/D012333/1] Funding Source: researchfish; NERC [NE/D012333/1] Funding Source: UKRI,Natural Environment Research Council(UK Research & Innovation (UKRI)Natural Environment Research Council (NERC)); Natural Environment Research Council(UK Research & Innovation (UKRI)Natural Environment Research Council (NERC)); NERC(UK Research & Innovation (UKRI)Natural Environment Research Council (NERC)),We are grateful to Diane Ellis and Martyn Stenning for technical help and to the Natural Environment Research Council for financial support (NE/D012333/1). We thank two anonymous referees for helpful comments on an earlier version of the manuscript.,,53,8,8,2,39,WILEY,HOBOKEN,"111 RIVER ST, HOBOKEN 07030-5774, NJ USA",0307-6946,1365-2311,,ECOL ENTOMOL,Ecol. Entomol.,OCT,2011,36,5,,,,,596,604,,10.1111/j.1365-2311.2011.01304.x,http://dx.doi.org/10.1111/j.1365-2311.2011.01304.x,,,9,Entomology,Science Citation Index Expanded (SCI-EXPANDED),Entomology,820OM,,,,,2023-05-23,WOS:000294915300009,View Full Record in Web of Science
J,"Suetsugu, K; Kawakita, A; Kato, M",,,,"Suetsugu, Kenji; Kawakita, Atsushi; Kato, Makoto",,,Host range and selectivity of the hemiparasitic plant Thesium chinense (Santalaceae),ANNALS OF BOTANY,,,English,Article,,,,,,haustorium; hemiparasite; host range; host selectivity; Santalaceae; Thesium chinense,RHINANTHUS-MINOR; PARASITIC PLANT; TRITICUM-VULGARE; HUMILE SANTALACEAE; OSMOTIC-PRESSURE; ROOT-PARASITISM; ANGIOSPERM; SCROPHULARIACEAE; HAUSTORIA; OROBANCHE,"Background and Aims Thesium chinense is a hemiparasitic plant that is common in grassland habitats of eastern Asia. Although the physiology of Thesium has been well studied in attempts to control its weedy habit, there have been few ecological investigations of its parasitic life history. Thesium chinense is thought to parasitize species of Poaceae, but evidence remains circumstantial. Methods A vegetation survey was conducted to test whether any plant species occurs significantly more often in plots with T. chinense than expected. In addition, haustorial connections were examined directly by excavating the roots and post-attachment host selectivity was evaluated by comparing the observed numbers of haustoria on different hosts against those expected according to the relative below-ground biomass. Haustorium sizes were also compared among host species. Key Results Only two of the 38 species recorded, Lespedeza juncea and Eragrostis curvula, occurred more often in plots with Thesium than expected. In contrast to this, T. chinense parasitized 22 plant species in 11 families, corresponding to 57.9 % of plant species found at the study site. Haustoria were non-randomly distributed among host species, suggesting that there is some post-attachment host selectivity. Thesium chinense generally preferred the Poaceae, although haustoria formed on the Fabaceae were larger than those on other hosts. Conclusions This is the first quantitative investigation of the host range and selectivity of hemiparasitic plants of the Santalales. The preference for Fabaceae as hosts may be linked to the greater nutrient availability in these nitrogen-fixing plants.","[Suetsugu, Kenji] Kyoto Univ, Fac Agr, Sakyo Ku, Kyoto 6068502, Japan; [Kawakita, Atsushi; Kato, Makoto] Kyoto Univ, Grad Sch Human & Environm Studies, Sakyo Ku, Kyoto 6068501, Japan",Kyoto University; Kyoto University,"Suetsugu, K (corresponding author), Kyoto Univ, Fac Agr, Sakyo Ku, Kitashirakawa Oiwake Cho, Kyoto 6068502, Japan.",kennji@seibutu.mbox.media.kyoto-u.ac.jp,"Suetsugu, Kenji/S-8762-2018","Suetsugu, Kenji/0000-0002-7943-4164",,,,,42,33,41,4,39,OXFORD UNIV PRESS,OXFORD,"GREAT CLARENDON ST, OXFORD OX2 6DP, ENGLAND",0305-7364,,,ANN BOT-LONDON,Ann. Bot.,JUL,2008,102,1,,,,,49,55,,10.1093/aob/mcn065,http://dx.doi.org/10.1093/aob/mcn065,,,7,Plant Sciences,Science Citation Index Expanded (SCI-EXPANDED),Plant Sciences,316VD,18492736,"Green Published, Bronze",,,2023-05-23,WOS:000256976900007,View Full Record in Web of Science
